,url,sentence,title,body,arbitration
300,https://stackoverflow.com/questions/4687271,JAX-RS ?How to return JSON and HTTP status code together?,JAX-RS ?How to return JSON and HTTP status code together?,"I'm writing a REST web app (NetBeans 6.9, JAX-RS, TopLink Essentials) and trying to return JSON and HTTP status code. I have code ready and working that returns JSON when the HTTP GET method is called from the client. Essentially: -CODE- . But I also want to return an HTTP status code (500, 200, 204, etc.) along with the JSON data. I tried to use HttpServletResponse: -CODE- . But this made the browser think it's a ""real"" 500 so the output web page was a regular HTTP 500 error page. I want to return an HTTP status code so that my client-side JavaScript can handle some logic depending on it (to e.g. display the error code and message on an HTML page). Is this possible or should HTTP status codes not be used for such thing?",yes
301,https://stackoverflow.com/questions/4687271,"But I also want to return an HTTP status code (500, 200, 204, etc.) along with the JSON data.",JAX-RS ?How to return JSON and HTTP status code together?,"I'm writing a REST web app (NetBeans 6.9, JAX-RS, TopLink Essentials) and trying to return JSON and HTTP status code. I have code ready and working that returns JSON when the HTTP GET method is called from the client. Essentially: -CODE- . But I also want to return an HTTP status code (500, 200, 204, etc.) along with the JSON data. I tried to use HttpServletResponse: -CODE- . But this made the browser think it's a ""real"" 500 so the output web page was a regular HTTP 500 error page. I want to return an HTTP status code so that my client-side JavaScript can handle some logic depending on it (to e.g. display the error code and message on an HTML page). Is this possible or should HTTP status codes not be used for such thing?",yes
302,https://stackoverflow.com/questions/676250,Different ways of loading a file as an InputStream,Different ways of loading a file as an InputStream,"What's the difference between: -CODE- . and: -CODE- . and: -CODE- . When are each one more appropriate to use than the others? The file that I want to read is in the classpath as my class that reads the file. My class and the file are in the same jar and packaged up in an EAR file, and deployed in WebSphere 6.1.",yes
303,https://stackoverflow.com/questions/29140402,"How do I print my Java object without getting ""","How do I print my Java object without getting ""SomeType@2f92e0f4""?",I have a class defined as follows: -CODE- . I tried to print an instance of my class: -CODE- . but I got the following output: com.foo.Person@2f92e0f4. A similar thing happened when I tried to print an array of Person objects: -CODE- . I got the output: [Lcom.foo.Person;@28a418fc. What does this output mean? How do I change this output so it contains the name of my person? And how do I print collections of my objects? Note: this is intended as a canonical Q&A about this subject.,yes
304,https://stackoverflow.com/questions/29140402,Note: this is intended as a canonical Q&A about this subject.,"How do I print my Java object without getting ""SomeType@2f92e0f4""?",I have a class defined as follows: -CODE- . I tried to print an instance of my class: -CODE- . but I got the following output: com.foo.Person@2f92e0f4. A similar thing happened when I tried to print an array of Person objects: -CODE- . I got the output: [Lcom.foo.Person;@28a418fc. What does this output mean? How do I change this output so it contains the name of my person? And how do I print collections of my objects? Note: this is intended as a canonical Q&A about this subject.,no
305,https://stackoverflow.com/questions/29140402,What does this output mean?,"How do I print my Java object without getting ""SomeType@2f92e0f4""?",I have a class defined as follows: -CODE- . I tried to print an instance of my class: -CODE- . but I got the following output: com.foo.Person@2f92e0f4. A similar thing happened when I tried to print an array of Person objects: -CODE- . I got the output: [Lcom.foo.Person;@28a418fc. What does this output mean? How do I change this output so it contains the name of my person? And how do I print collections of my objects? Note: this is intended as a canonical Q&A about this subject.,no
306,https://stackoverflow.com/questions/13592236,Parse a URI String into Name-Value Collection,Parse a URI String into Name-Value Collection,"I've got the URI like this: -CODE- . I need a collection with parsed elements: -CODE- . To be exact, I need a Java equivalent for C# HttpUtility.ParseQueryString Method. Please, give me an advice on this. Thanks.",yes
307,https://stackoverflow.com/questions/19976487,Explicitly calling a default method in Java,Explicitly calling a default method in Java,"Java 8 introduces default methods to provide the ability to extend interfaces without the need to modify existing implementations. I wonder if it's possible to explicitly invoke the default implementation of a method when that method has been overridden or is not available because of conflicting default implementations in different interfaces. -CODE- . Considering the code above, how would you call A.foo() from a method of class B?",no
308,https://stackoverflow.com/questions/19976487,Java 8 introduces default methods to provide the ability to extend interfaces without the need to modify existing implementations.,Explicitly calling a default method in Java,"Java 8 introduces default methods to provide the ability to extend interfaces without the need to modify existing implementations. I wonder if it's possible to explicitly invoke the default implementation of a method when that method has been overridden or is not available because of conflicting default implementations in different interfaces. -CODE- . Considering the code above, how would you call A.foo() from a method of class B?",no
309,https://stackoverflow.com/questions/14602062,Java String split removed empty values,Java String split removed empty values,"I am trying to split the Value using a separator. But I am finding the surprising results: -CODE- . I am expecting to get 8 values. [5,6,7,EMPTY,8,9,EMPTY,EMPTY] But I am getting only 6 values. Any idea and how to fix. No matter EMPTY value comes at anyplace, it should be in array.",yes
310,https://stackoverflow.com/questions/14602062,I am expecting to get 8 values.,Java String split removed empty values,"I am trying to split the Value using a separator. But I am finding the surprising results: -CODE- . I am expecting to get 8 values. [5,6,7,EMPTY,8,9,EMPTY,EMPTY] But I am getting only 6 values. Any idea and how to fix. No matter EMPTY value comes at anyplace, it should be in array.",no
311,https://stackoverflow.com/questions/14602062,Any idea and how to fix.,Java String split removed empty values,"I am trying to split the Value using a separator. But I am finding the surprising results: -CODE- . I am expecting to get 8 values. [5,6,7,EMPTY,8,9,EMPTY,EMPTY] But I am getting only 6 values. Any idea and how to fix. No matter EMPTY value comes at anyplace, it should be in array.",no
312,https://stackoverflow.com/questions/4534146,Properly removing an Integer from a List<Integer>,Properly removing an Integer from a List<Integer>,"Here's a nice pitfall I just encountered. Consider a list of integers: -CODE- . Any educated guess on what happens when you execute list.remove(1)? What about list.remove(new Integer(1))? This can cause some nasty bugs. What is the proper way to differentiate between remove(int index), which removes an element from given index and remove(Object o), which removes an element by reference, when dealing with lists of integers? The main point to consider here is the one @Nikita mentioned - exact parameter matching takes precedence over auto-boxing.",yes
313,https://stackoverflow.com/questions/247059,Is there a Newline constant defined in Java like Environment.Newline in C#?,Is there a Newline constant defined in Java like Environment.Newline in C#?,In C# there is the static property Environment.Newline that changed depending on the running platform. Is there anything similar in Java?,no
314,https://stackoverflow.com/questions/6916385,"How can I create a concurrent List instance, where I can access elements by index?",Is there a concurrent List in Java's JDK?,"How can I create a concurrent List instance, where I can access elements by index? Does the JDK have any classes or factory methods I can use?",yes
315,https://stackoverflow.com/questions/469287,"(I don't want to start a language flame war, I just want to know how to do some things in C# that I used to do in Java).",C# vs Java Enum (for those new to C#),"I've been programming in Java for a while and just got thrown onto a project that's written entirely in C#. I'm trying to come up to speed in C#, and noticed enums used in several places in my new project, but at first glance, C#'s enums seem to be more simplistic than the Java 1.5+ implementation. Can anyone enumerate the differences between C# and Java enums, and how to overcome the differences? (I don't want to start a language flame war, I just want to know how to do some things in C# that I used to do in Java). For example, could someone post a C# counterpart to Sun's famous Planet enum example? -CODE- .",no
316,https://stackoverflow.com/questions/54405842,[5]Short Conversion = 679,Why is if (variable1 % variable2 == 0) inefficient?,"I am new to java, and was running some code last night, and this really bothered me. I was building a simple program to display every X outputs in a for loop, and I noticed a MASSIVE decrease in performance, when I used modulus as variable % variable vs variable % 5000 or whatnot. Can someone explain to me why this is and what is causing it? So I can be better... Here is the ""efficient"" code (sorry if I get a bit of syntax wrong I'm not on the computer with the code right now) -CODE- . Here is the ""inefficient code"" -CODE- . Mind you I had a date variable to measure the differences, and once it became long enough, the first one took 50ms while the other took 12 seconds or something like that. You may have to increase the stopNum or decrease the progressCheck if your PC is more efficient than mine or what not. I looked for this question around the web, but I can't find an answer, maybe I'm just not asking it right. EDIT: I did not expect my question to be so popular, I appreciate all the answers. I did perform a benchmark on each half in time taken, and the inefficient code took considerably longer, 1/4 of a second vs 10 seconds give or take. Granted they are using println, but they are both doing the same amount, so I wouldn't imagine that would skew it much, especially since the discrepancy is repeatable. As for the answers, since I am new to Java, I will let votes decide for now which answer is best. I will try to pick one by Wednesday. EDIT2: I am going to make another test tonight, where instead of modulus, it just increments a variable, and when it reaches progressCheck, it will perform one, and then reset that variable to 0. for a 3rd option. EDIT3.5: I used this code, and below I'll show my results.. Thank you ALL for the wonderful help! I also tried comparing the short value of the long to 0, so all my new checks happen ever ""65536"" times making it equal in repeats. -CODE- . Results: [1]fixed = 874 ms (normally around 1000ms, but faster due to it being a power of 2). [2]variable = 8590 ms. [3]final variable = 1944 ms (Was ~1000ms when using 50000). [4]increment = 1904 ms. [5]Short Conversion = 679 ms. Not surprising enough, due to a lack of division, the Short Conversion was 23% faster than the ""fast"" way. This is interesting to note. If you need to show or compare something every 256 times (or about there) you can do this, and use : -CODE- . ONE FINAL INTERESTING NOTE, using modulus on the ""Final declared Variable"" with 65536 (not a pretty number) was half the speed of (slower) than the fixed value. Where before it was benchmarking near the same speed.",no
317,https://stackoverflow.com/questions/54405842,This is interesting to note.,Why is if (variable1 % variable2 == 0) inefficient?,"I am new to java, and was running some code last night, and this really bothered me. I was building a simple program to display every X outputs in a for loop, and I noticed a MASSIVE decrease in performance, when I used modulus as variable % variable vs variable % 5000 or whatnot. Can someone explain to me why this is and what is causing it? So I can be better... Here is the ""efficient"" code (sorry if I get a bit of syntax wrong I'm not on the computer with the code right now) -CODE- . Here is the ""inefficient code"" -CODE- . Mind you I had a date variable to measure the differences, and once it became long enough, the first one took 50ms while the other took 12 seconds or something like that. You may have to increase the stopNum or decrease the progressCheck if your PC is more efficient than mine or what not. I looked for this question around the web, but I can't find an answer, maybe I'm just not asking it right. EDIT: I did not expect my question to be so popular, I appreciate all the answers. I did perform a benchmark on each half in time taken, and the inefficient code took considerably longer, 1/4 of a second vs 10 seconds give or take. Granted they are using println, but they are both doing the same amount, so I wouldn't imagine that would skew it much, especially since the discrepancy is repeatable. As for the answers, since I am new to Java, I will let votes decide for now which answer is best. I will try to pick one by Wednesday. EDIT2: I am going to make another test tonight, where instead of modulus, it just increments a variable, and when it reaches progressCheck, it will perform one, and then reset that variable to 0. for a 3rd option. EDIT3.5: I used this code, and below I'll show my results.. Thank you ALL for the wonderful help! I also tried comparing the short value of the long to 0, so all my new checks happen ever ""65536"" times making it equal in repeats. -CODE- . Results: [1]fixed = 874 ms (normally around 1000ms, but faster due to it being a power of 2). [2]variable = 8590 ms. [3]final variable = 1944 ms (Was ~1000ms when using 50000). [4]increment = 1904 ms. [5]Short Conversion = 679 ms. Not surprising enough, due to a lack of division, the Short Conversion was 23% faster than the ""fast"" way. This is interesting to note. If you need to show or compare something every 256 times (or about there) you can do this, and use : -CODE- . ONE FINAL INTERESTING NOTE, using modulus on the ""Final declared Variable"" with 65536 (not a pretty number) was half the speed of (slower) than the fixed value. Where before it was benchmarking near the same speed.",no
318,https://stackoverflow.com/questions/54405842,[4]increment = 1904,Why is if (variable1 % variable2 == 0) inefficient?,"I am new to java, and was running some code last night, and this really bothered me. I was building a simple program to display every X outputs in a for loop, and I noticed a MASSIVE decrease in performance, when I used modulus as variable % variable vs variable % 5000 or whatnot. Can someone explain to me why this is and what is causing it? So I can be better... Here is the ""efficient"" code (sorry if I get a bit of syntax wrong I'm not on the computer with the code right now) -CODE- . Here is the ""inefficient code"" -CODE- . Mind you I had a date variable to measure the differences, and once it became long enough, the first one took 50ms while the other took 12 seconds or something like that. You may have to increase the stopNum or decrease the progressCheck if your PC is more efficient than mine or what not. I looked for this question around the web, but I can't find an answer, maybe I'm just not asking it right. EDIT: I did not expect my question to be so popular, I appreciate all the answers. I did perform a benchmark on each half in time taken, and the inefficient code took considerably longer, 1/4 of a second vs 10 seconds give or take. Granted they are using println, but they are both doing the same amount, so I wouldn't imagine that would skew it much, especially since the discrepancy is repeatable. As for the answers, since I am new to Java, I will let votes decide for now which answer is best. I will try to pick one by Wednesday. EDIT2: I am going to make another test tonight, where instead of modulus, it just increments a variable, and when it reaches progressCheck, it will perform one, and then reset that variable to 0. for a 3rd option. EDIT3.5: I used this code, and below I'll show my results.. Thank you ALL for the wonderful help! I also tried comparing the short value of the long to 0, so all my new checks happen ever ""65536"" times making it equal in repeats. -CODE- . Results: [1]fixed = 874 ms (normally around 1000ms, but faster due to it being a power of 2). [2]variable = 8590 ms. [3]final variable = 1944 ms (Was ~1000ms when using 50000). [4]increment = 1904 ms. [5]Short Conversion = 679 ms. Not surprising enough, due to a lack of division, the Short Conversion was 23% faster than the ""fast"" way. This is interesting to note. If you need to show or compare something every 256 times (or about there) you can do this, and use : -CODE- . ONE FINAL INTERESTING NOTE, using modulus on the ""Final declared Variable"" with 65536 (not a pretty number) was half the speed of (slower) than the fixed value. Where before it was benchmarking near the same speed.",no
319,https://stackoverflow.com/questions/1458535,Which types can be used for Java annotation members?,Which types can be used for Java annotation members?,Today I wanted to create my first annotation interface following this documentation and I got the compiler error : -CODE- . Obviously Object cannot be used as type of an annotation member. Unfortunately I could not find any information on which types can be used in general. This I found out using trial-and-error: [1]String ?Valid. [2]int ?Valid. [3]Integer ?Invalid (Surprisingly). [4]String[] ?Valid (Surprisingly). [5]Object ?Invalid. Perhaps someone can shed some light on which types are actually allowed and why.,no
320,https://stackoverflow.com/questions/1458535,[4]String[] ?Valid (Surprisingly).,Which types can be used for Java annotation members?,Today I wanted to create my first annotation interface following this documentation and I got the compiler error : -CODE- . Obviously Object cannot be used as type of an annotation member. Unfortunately I could not find any information on which types can be used in general. This I found out using trial-and-error: [1]String ?Valid. [2]int ?Valid. [3]Integer ?Invalid (Surprisingly). [4]String[] ?Valid (Surprisingly). [5]Object ?Invalid. Perhaps someone can shed some light on which types are actually allowed and why.,no
321,https://stackoverflow.com/questions/1458535,[3]Integer ?Invalid (Surprisingly).,Which types can be used for Java annotation members?,Today I wanted to create my first annotation interface following this documentation and I got the compiler error : -CODE- . Obviously Object cannot be used as type of an annotation member. Unfortunately I could not find any information on which types can be used in general. This I found out using trial-and-error: [1]String ?Valid. [2]int ?Valid. [3]Integer ?Invalid (Surprisingly). [4]String[] ?Valid (Surprisingly). [5]Object ?Invalid. Perhaps someone can shed some light on which types are actually allowed and why.,no
322,https://stackoverflow.com/questions/1458535,[2]int,Which types can be used for Java annotation members?,Today I wanted to create my first annotation interface following this documentation and I got the compiler error : -CODE- . Obviously Object cannot be used as type of an annotation member. Unfortunately I could not find any information on which types can be used in general. This I found out using trial-and-error: [1]String ?Valid. [2]int ?Valid. [3]Integer ?Invalid (Surprisingly). [4]String[] ?Valid (Surprisingly). [5]Object ?Invalid. Perhaps someone can shed some light on which types are actually allowed and why.,no
323,https://stackoverflow.com/questions/1458535,[2]int,Which types can be used for Java annotation members?,Today I wanted to create my first annotation interface following this documentation and I got the compiler error : -CODE- . Obviously Object cannot be used as type of an annotation member. Unfortunately I could not find any information on which types can be used in general. This I found out using trial-and-error: [1]String ?Valid. [2]int ?Valid. [3]Integer ?Invalid (Surprisingly). [4]String[] ?Valid (Surprisingly). [5]Object ?Invalid. Perhaps someone can shed some light on which types are actually allowed and why.,no
324,https://stackoverflow.com/questions/2564298,Java: how to initialize String[]?,Java: how to initialize String[]?,Error: -CODE- . Code: -CODE- .,yes
325,https://stackoverflow.com/questions/2564298,Error: -CODE- .,Java: how to initialize String[]?,Error: -CODE- . Code: -CODE- .,no
326,https://stackoverflow.com/questions/11552248,When to use @QueryParam vs @PathParam,When to use @QueryParam vs @PathParam,"I am not asking the question that is already asked here: What is the difference between @PathParam and @QueryParam. This is a ""best practices"" or convention question. When would you use @PathParam vs @QueryParam. What I can think of that the decision might be using the two to differentiate the information pattern. Let me illustrate below my LTPO - less than perfect observation. PathParam use could be reserved for information category, which would fall nicely into a branch of an information tree. PathParam could be used to drill down to entity class hierarchy. Whereas, QueryParam could be reserved for specifying attributes to locate the instance of a class. For example, [1]/Vehicle/Car?registration=123. [2]/House/Colonial?region=newengland. /category?instance: -CODE- . vs /category/instance: -CODE- . vs ?category+instance: -CODE- . I don't think there is a standard convention of doing it. Is there? However, I would like to hear of how people use PathParam vs QueryParam to differentiate their information like I exemplified above. I would also love to hear the reason behind the practice.",no
327,https://stackoverflow.com/questions/11552248,vs ?,When to use @QueryParam vs @PathParam,"I am not asking the question that is already asked here: What is the difference between @PathParam and @QueryParam. This is a ""best practices"" or convention question. When would you use @PathParam vs @QueryParam. What I can think of that the decision might be using the two to differentiate the information pattern. Let me illustrate below my LTPO - less than perfect observation. PathParam use could be reserved for information category, which would fall nicely into a branch of an information tree. PathParam could be used to drill down to entity class hierarchy. Whereas, QueryParam could be reserved for specifying attributes to locate the instance of a class. For example, [1]/Vehicle/Car?registration=123. [2]/House/Colonial?region=newengland. /category?instance: -CODE- . vs /category/instance: -CODE- . vs ?category+instance: -CODE- . I don't think there is a standard convention of doing it. Is there? However, I would like to hear of how people use PathParam vs QueryParam to differentiate their information like I exemplified above. I would also love to hear the reason behind the practice.",no
328,https://stackoverflow.com/questions/11552248,"This is a ""best practices"" or convention question.",When to use @QueryParam vs @PathParam,"I am not asking the question that is already asked here: What is the difference between @PathParam and @QueryParam. This is a ""best practices"" or convention question. When would you use @PathParam vs @QueryParam. What I can think of that the decision might be using the two to differentiate the information pattern. Let me illustrate below my LTPO - less than perfect observation. PathParam use could be reserved for information category, which would fall nicely into a branch of an information tree. PathParam could be used to drill down to entity class hierarchy. Whereas, QueryParam could be reserved for specifying attributes to locate the instance of a class. For example, [1]/Vehicle/Car?registration=123. [2]/House/Colonial?region=newengland. /category?instance: -CODE- . vs /category/instance: -CODE- . vs ?category+instance: -CODE- . I don't think there is a standard convention of doing it. Is there? However, I would like to hear of how people use PathParam vs QueryParam to differentiate their information like I exemplified above. I would also love to hear the reason behind the practice.",no
