,url,sentence,title,body,arbitration
350,https://stackoverflow.com/questions/25747499,Update,Java 8: Calculate difference between two LocalDateTime,"I am trying to calculate the difference between two LocalDateTime. The output needs to be of the format y years m months d days h hours m minutes s seconds. Here is what I have written: -CODE- . The output that I am getting is 29 years 8 months 24 days 12 hours 0 minutes 50 seconds. I have checked my result from this website (with values 12/16/1984 07:45:55 and 09/09/2014 19:46:45). The following screenshot shows the output: I am pretty sure that the fields after the month value is coming wrong from my code. Any suggestion would be very helpful. Update I have tested my result from another website and the result I got is different. Here it is: Calculate duration between two dates (result: 29 years, 8 months, 24 days, 12 hours, 0 minutes and 50 seconds). Update Since I got two different results from two different sites, I am wondering if the algorithm of my calculation is legitimate or not. If I use following two LocalDateTime objects: -CODE- . Then the output is coming: 29 years 8 months 25 days -1 hours -5 minutes -10 seconds. From this link it should be 29 years 8 months 24 days 22 hours, 54 minutes and 50 seconds. So the algorithm needs to handle the negative numbers too. Note the question is not about which site gave me what result, I need to know the right algorithm and need to have right results.",no
351,https://stackoverflow.com/questions/24676375,* 1024 compile without error?,Why does int i = 1024 * 1024 * 1024 * 1024 compile without error?,"The limit of int is from -2147483648 to 2147483647. If I input : -CODE- . then Eclipse will prompt a red underline under ""2147483648"". But if I do this: -CODE- . it will compile fine. -CODE- . Maybe it's a basic question in Java, but I have no idea why the second variant produces no error.",no
352,https://stackoverflow.com/questions/24676375,The limit of int is from -2147483648 to 2147483647.,Why does int i = 1024 * 1024 * 1024 * 1024 compile without error?,"The limit of int is from -2147483648 to 2147483647. If I input : -CODE- . then Eclipse will prompt a red underline under ""2147483648"". But if I do this: -CODE- . it will compile fine. -CODE- . Maybe it's a basic question in Java, but I have no idea why the second variant produces no error.",no
353,https://stackoverflow.com/questions/443499,Convert JSON to Map,Convert JSON to Map,"What is the best way to convert a JSON code as this: -CODE- . in a Java Map in which one the keys are (field1, field2) and the values for those fields are (value1, value2). Any ideas? Should I use Json-lib for that? Or better if I write my own parser?",yes
354,https://stackoverflow.com/questions/443499,Any ideas?,Convert JSON to Map,"What is the best way to convert a JSON code as this: -CODE- . in a Java Map in which one the keys are (field1, field2) and the values for those fields are (value1, value2). Any ideas? Should I use Json-lib for that? Or better if I write my own parser?",no
355,https://stackoverflow.com/questions/443499,What is the best way to convert a JSON code as this: -CODE- .,Convert JSON to Map,"What is the best way to convert a JSON code as this: -CODE- . in a Java Map in which one the keys are (field1, field2) and the values for those fields are (value1, value2). Any ideas? Should I use Json-lib for that? Or better if I write my own parser?",yes
356,https://stackoverflow.com/questions/1830698,What is InputStream & Output Stream?,What is InputStream & Output Stream? Why and when do we use them?,"Someone explain to me what InputStream and OutputStream are? I am confused about the use cases for both InputStream and OutputStream. If you could also include a snippet of code to go along with your explanation, that would be great. Thanks!",no
357,https://stackoverflow.com/questions/1830698,I am confused about the use cases for both InputStream and OutputStream.,What is InputStream & Output Stream? Why and when do we use them?,"Someone explain to me what InputStream and OutputStream are? I am confused about the use cases for both InputStream and OutputStream. If you could also include a snippet of code to go along with your explanation, that would be great. Thanks!",no
358,https://stackoverflow.com/questions/1830698,Someone explain to me what InputStream and OutputStream are?,What is InputStream & Output Stream? Why and when do we use them?,"Someone explain to me what InputStream and OutputStream are? I am confused about the use cases for both InputStream and OutputStream. If you could also include a snippet of code to go along with your explanation, that would be great. Thanks!",no
359,https://stackoverflow.com/questions/4778113,(64 bit),Android Eclipse - Could not find *.apk,"I know this question has been asked before and I have seen a plethora of solutions out there, yet none seem to work for me. I was able to build my apk without issues until this error started cropping up. I have tried cleaning my project, removing it from the workspace and reimporting it, removing ""Java Builder"" from my Builders for the project, building the project manually, reordering my java build path. I have no visible compiler issues and no problems exist in my workspace. I did experience this issue before and solved it once by removing the project form my workspace and re-importing it and another time I solved it by removing ""Java Builder"" from my java build path. None seem to work this time. I currently have most of the settings set back to default (i.e. java build is checked again). I am running windows 7 (64 bit) and using jdk1.6.0_21 via Eclipse 3.6. Any suggestions would be greatly appreciated as I have lost loads of development time troubleshooting this already. [Update] My locale is English & I have tried removing the debug.keystore, United States as related to issue 834.",no
360,https://stackoverflow.com/questions/4818699,Practical uses for AtomicInteger,Practical uses for AtomicInteger,I sort of understand that AtomicInteger and other Atomic variables allow concurrent accesses. In what cases is this class typically used though?,yes
361,https://stackoverflow.com/questions/2469911,How do I assert my exception message with JUnit Test annotation?,How do I assert my exception message with JUnit Test annotation?,"I have written a few JUnit tests with @Test annotation. If my test method throws a checked exception and if I want to assert the message along with the exception, is there a way to do so with JUnit @Test annotation? AFAIK, JUnit 4.7 doesn't provide this feature but does any future versions provide it? I know in .NET you can assert the message and the exception class. Looking for similar feature in the Java world. This is what I want: -CODE- .",no
362,https://stackoverflow.com/questions/2469911,I have written a few JUnit tests with @Test annotation.,How do I assert my exception message with JUnit Test annotation?,"I have written a few JUnit tests with @Test annotation. If my test method throws a checked exception and if I want to assert the message along with the exception, is there a way to do so with JUnit @Test annotation? AFAIK, JUnit 4.7 doesn't provide this feature but does any future versions provide it? I know in .NET you can assert the message and the exception class. Looking for similar feature in the Java world. This is what I want: -CODE- .",no
363,https://stackoverflow.com/questions/2469911,", JUnit 4.7 doesn't provide this feature but does any future versions provide it?",How do I assert my exception message with JUnit Test annotation?,"I have written a few JUnit tests with @Test annotation. If my test method throws a checked exception and if I want to assert the message along with the exception, is there a way to do so with JUnit @Test annotation? AFAIK, JUnit 4.7 doesn't provide this feature but does any future versions provide it? I know in .NET you can assert the message and the exception class. Looking for similar feature in the Java world. This is what I want: -CODE- .",no
364,https://stackoverflow.com/questions/2469911,", JUnit 4.7 doesn't provide this feature but does any future versions provide it?",How do I assert my exception message with JUnit Test annotation?,"I have written a few JUnit tests with @Test annotation. If my test method throws a checked exception and if I want to assert the message along with the exception, is there a way to do so with JUnit @Test annotation? AFAIK, JUnit 4.7 doesn't provide this feature but does any future versions provide it? I know in .NET you can assert the message and the exception class. Looking for similar feature in the Java world. This is what I want: -CODE- .",no
365,https://stackoverflow.com/questions/19943766,"Hadoop ""Unable to load native-hadoop library for your platform"" warning","Hadoop ""Unable to load native-hadoop library for your platform"" warning","I'm currently configuring hadoop on a server running CentOs. When I run start-dfs.sh or stop-dfs.sh, I get the following error: -CODE- . I'm running Hadoop 2.2.0. Doing a search online brought up this link: http://balanceandbreath.blogspot.ca/2013/01/utilnativecodeloader-unable-to-load.html. However, the contents of /native/ directory on hadoop 2.x appear to be different so I am not sure what to do. I've also added these two environment variables in hadoop-env.sh: -CODE- . Any ideas?",no
366,https://stackoverflow.com/questions/19943766,Any ideas?,"Hadoop ""Unable to load native-hadoop library for your platform"" warning","I'm currently configuring hadoop on a server running CentOs. When I run start-dfs.sh or stop-dfs.sh, I get the following error: -CODE- . I'm running Hadoop 2.2.0. Doing a search online brought up this link: http://balanceandbreath.blogspot.ca/2013/01/utilnativecodeloader-unable-to-load.html. However, the contents of /native/ directory on hadoop 2.x appear to be different so I am not sure what to do. I've also added these two environment variables in hadoop-env.sh: -CODE- . Any ideas?",no
367,https://stackoverflow.com/questions/9560600,Any ideas?,Java - No enclosing instance of type Foo is accessible,"I have the following code: -CODE- . I know Thing does nothing, but my Hello, World program compiles just fine without it. It's only my defined classes that are failing on me. And it refuses to compile. I get No enclosing instance of type Hello is accessible."" at the line that creates a new Thing. I'm guessing either: [1]I have system level problems (either in DrJava or my Java install) or. [2]I have some basic misunderstanding of how to construct a working program in java.. Any ideas?",no
368,https://stackoverflow.com/questions/8405087,2011-08-12T20:17:46.384Z,What is this date format? 2011-08-12T20:17:46.384Z,"I have the following date: 2011-08-12T20:17:46.384Z. What format is this? I'm trying to parse it with Java 1.4 via DateFormat.getDateInstance().parse(dateStr) and I'm getting: -CODE- . I think I should be using SimpleDateFormat for parsing, but I have to know the format string first. All I have for that so far is yyyy-MM-dd, because I don't know what the T means in this string--something time zone-related? This date string is coming from the lcmis:downloadedOn tag shown on Files CMIS download history media type.",no
369,https://stackoverflow.com/questions/2306190,Java Desktop application: SWT vs. Swing,Java Desktop application: SWT vs. Swing,"I'm a web developer at day and thinking about building my first real desktop application. The idea is to build a tool that automates a very repetitive task in a web application where no API is available. I know I want to use Java. I used it before for web stuff, know the syntax pretty well and want the application to be cross plattform as easy as possible. Where I'm not so sure is if I should use SWT or Swing. As my main audience uses Windows, I want to look it as native as possible there. Linux and Mac should work, but the looks are not so important here. So what are the arguments for and against each UI Framework, Swing or SWT? Thanks. PS: I develop on Windows using Eclipse. But was thinking about playing with Netbeans.",no
370,https://stackoverflow.com/questions/1011863,How do I speed up the gwt compiler?,How do I speed up the gwt compiler?,"We're starting to make heavier use of GWT in our projects, and the performance of the GWT compiler is becoming increasingly annoying. We're going to start altering our working practices to mitigate the problem, including a greater emphasis on the hosted-mode browser, which defers the need to run the GWT compiler until a later time, but that brings its own risks, particularly that of not catching issues with real browsers until much later than we'd like. Ideally, we'd like to make the GWT compiler itself quicker - a minute to compile a fairly small application is taking the piss. However, we are using the compile if a fairly naive fashion, so I'm hoping we can make some quick and easy gains. We're currently invoking com.google.gwt.dev.Compiler as a java application from ant Ant target, with 256m max heap and lots of stack space. The compiler is launched by Ant using fork=true and the latest Java 6 JRE, to try and take advantage of Java6's improved performance. We pass our main controller class to the compiler along with the application classpath, and off it goes. What else can we do to get some extra speed? Can we give it more information so it spends less time doing discovery of what to do? I know we can tell it to only compile for one browser, but we need to do multi-browser testing, so that's not really practical. All suggestions welcome at this point.",no
371,https://stackoverflow.com/questions/1011863,What else can we do to get some extra speed?,How do I speed up the gwt compiler?,"We're starting to make heavier use of GWT in our projects, and the performance of the GWT compiler is becoming increasingly annoying. We're going to start altering our working practices to mitigate the problem, including a greater emphasis on the hosted-mode browser, which defers the need to run the GWT compiler until a later time, but that brings its own risks, particularly that of not catching issues with real browsers until much later than we'd like. Ideally, we'd like to make the GWT compiler itself quicker - a minute to compile a fairly small application is taking the piss. However, we are using the compile if a fairly naive fashion, so I'm hoping we can make some quick and easy gains. We're currently invoking com.google.gwt.dev.Compiler as a java application from ant Ant target, with 256m max heap and lots of stack space. The compiler is launched by Ant using fork=true and the latest Java 6 JRE, to try and take advantage of Java6's improved performance. We pass our main controller class to the compiler along with the application classpath, and off it goes. What else can we do to get some extra speed? Can we give it more information so it spends less time doing discovery of what to do? I know we can tell it to only compile for one browser, but we need to do multi-browser testing, so that's not really practical. All suggestions welcome at this point.",no
372,https://stackoverflow.com/questions/1011863,"However, we are using the compile if a fairly naive fashion, so I'm hoping we can make some quick and easy gains.",How do I speed up the gwt compiler?,"We're starting to make heavier use of GWT in our projects, and the performance of the GWT compiler is becoming increasingly annoying. We're going to start altering our working practices to mitigate the problem, including a greater emphasis on the hosted-mode browser, which defers the need to run the GWT compiler until a later time, but that brings its own risks, particularly that of not catching issues with real browsers until much later than we'd like. Ideally, we'd like to make the GWT compiler itself quicker - a minute to compile a fairly small application is taking the piss. However, we are using the compile if a fairly naive fashion, so I'm hoping we can make some quick and easy gains. We're currently invoking com.google.gwt.dev.Compiler as a java application from ant Ant target, with 256m max heap and lots of stack space. The compiler is launched by Ant using fork=true and the latest Java 6 JRE, to try and take advantage of Java6's improved performance. We pass our main controller class to the compiler along with the application classpath, and off it goes. What else can we do to get some extra speed? Can we give it more information so it spends less time doing discovery of what to do? I know we can tell it to only compile for one browser, but we need to do multi-browser testing, so that's not really practical. All suggestions welcome at this point.",no
373,https://stackoverflow.com/questions/1371369,Can constructors throw exceptions in Java?,Can constructors throw exceptions in Java?,Are constructors allowed to throw exceptions?,no
374,https://stackoverflow.com/questions/6834037,Initialize a long in Java,Initialize a long in Java,"Primitive Data Types - oracle doc says the range of long in Java is -9,223,372,036,854,775,808 to 9,223,372,036,854,775,807. But when I do something like this in my eclipse: -CODE- . it shows me ""The literal 12345678910 of type int is out of range"" error. There are 2 questions. 1) How do I initialize the long with the value 12345678910? 2) Are all numeric literals by default of type int?",yes
375,https://stackoverflow.com/questions/6834037,"it shows me ""The literal 12345678910 of type int is out of range"" error.",Initialize a long in Java,"Primitive Data Types - oracle doc says the range of long in Java is -9,223,372,036,854,775,808 to 9,223,372,036,854,775,807. But when I do something like this in my eclipse: -CODE- . it shows me ""The literal 12345678910 of type int is out of range"" error. There are 2 questions. 1) How do I initialize the long with the value 12345678910? 2) Are all numeric literals by default of type int?",no
376,https://stackoverflow.com/questions/3101128,How do I fix this? -CODE- .,"""java.lang.OutOfMemoryError: PermGen space"" in Maven build","I'm getting this error while building Maven project, I increased MAVEN_OPTS but all the same, I found some similar posts but they are refering to something else. How do I fix this? -CODE- .",no
377,https://stackoverflow.com/questions/19039752,[3]JAVA_HOME is pointing to JDK 6..,Removing Java 8 JDK from Mac,"So I installed the beta of JDK 8 a while ago to look at some of the examples. I thought for sure by now, it's easy to change between versions. Doing some Play development with IntelliJ. For some reason, IntelliJ is compiling with 8 even though: [1]I have the compiler set in Preferences to use 1.6. [2]Supposedly it's using SBT through external build, but sbt from the command line works. [3]JAVA_HOME is pointing to JDK 6.. If I go to the Java Preferences page, it does show 8 installed, but there is no option to uninstall it and it doesn't see any of the other versions. When I do which java, it tells me /usr/bin/java and I do /usr/bin/java -version and it returns 1.6. Note: with a little fiddling, you can use IntelliJ and JDK7, see here.",no
378,https://stackoverflow.com/questions/409932,Java Timer vs ExecutorService?,Java Timer vs ExecutorService?,"I have code where I schedule a task using java.util.timer. I was looking around and saw ExecutorService can do the same. So this question here, have you used Timer and ExecutorService to schedule tasks, what is the benefit of one using over another? Also wanted to check if anyone had used the Timer class and ran into any issues which the ExecutorService solved for them.",no
379,https://stackoverflow.com/questions/409932,I was looking around and saw ExecutorService can do the same.,Java Timer vs ExecutorService?,"I have code where I schedule a task using java.util.timer. I was looking around and saw ExecutorService can do the same. So this question here, have you used Timer and ExecutorService to schedule tasks, what is the benefit of one using over another? Also wanted to check if anyone had used the Timer class and ran into any issues which the ExecutorService solved for them.",no
380,https://stackoverflow.com/questions/8194713,Difference between java/javaw/javaws,Difference between java/javaw/javaws,"I am wondering, what's the difference between java/javaw/javaws? I found under windows, most of Java is started using javaw.",no
381,https://stackoverflow.com/questions/5730815,Unable to locate tools.jar,Unable to locate tools.jar,I am building a project in Java. I have this error: -CODE- . I have installed a JDK and the folder: C:\Program Files\Java\jre6\lib is in my system but the file tools.jar is not there.,no
382,https://stackoverflow.com/questions/33147339,Difference between,Difference between if (a - b < 0) and if (a < b),"I was reading Java's ArrayList source code and noticed some comparisons in if-statements. In Java 7, the method grow(int) uses: -CODE- . In Java 6, grow didn't exist. The method ensureCapacity(int) however uses: -CODE- . What was the reason behind the change? Was it a performance issue or just a style? I could imagine that comparing against zero is faster, but performing a complete subtraction just to check whether it's negative seems a bit overkill to me. Also in terms of bytecode, this would involve two instructions (ISUB and IF_ICMPGE) instead of one (IFGE).",no
383,https://stackoverflow.com/questions/33147339,Difference between,Difference between if (a - b < 0) and if (a < b),"I was reading Java's ArrayList source code and noticed some comparisons in if-statements. In Java 7, the method grow(int) uses: -CODE- . In Java 6, grow didn't exist. The method ensureCapacity(int) however uses: -CODE- . What was the reason behind the change? Was it a performance issue or just a style? I could imagine that comparing against zero is faster, but performing a complete subtraction just to check whether it's negative seems a bit overkill to me. Also in terms of bytecode, this would involve two instructions (ISUB and IF_ICMPGE) instead of one (IFGE).",no
384,https://stackoverflow.com/questions/33147339,What was the reason behind the change?,Difference between if (a - b < 0) and if (a < b),"I was reading Java's ArrayList source code and noticed some comparisons in if-statements. In Java 7, the method grow(int) uses: -CODE- . In Java 6, grow didn't exist. The method ensureCapacity(int) however uses: -CODE- . What was the reason behind the change? Was it a performance issue or just a style? I could imagine that comparing against zero is faster, but performing a complete subtraction just to check whether it's negative seems a bit overkill to me. Also in terms of bytecode, this would involve two instructions (ISUB and IF_ICMPGE) instead of one (IFGE).",no
385,https://stackoverflow.com/questions/3949260,vs Class.isAssignableFrom,java: Class.isInstance vs Class.isAssignableFrom,"Let clazz be some Class and obj be some Object. Is: -CODE- . always the same as: -CODE- . ? If not, what are the differences?",no
386,https://stackoverflow.com/questions/3949260,vs Class.isAssignableFrom,java: Class.isInstance vs Class.isAssignableFrom,"Let clazz be some Class and obj be some Object. Is: -CODE- . always the same as: -CODE- . ? If not, what are the differences?",no
387,https://stackoverflow.com/questions/9424364,Any ideas on workarounds ?,Can't compile project when I'm using Lombok under IntelliJ IDEA,I'm trying to use Lombok in my project that I'm developing using IntelliJ IDEA 11. I've installed 3rd-party plugin for IDEA and it seems working fine because IDEA sees all autogenerated methods/fields. So I have a class that uses Slf4j. I annotated it like this: -CODE- . But when I build my project compiler spits: cannot find symbol variable log. Could you please tell me what I'm missing here ? Update: It turned out it's RequestFactory annotation process that fails. -CODE- . Any ideas on workarounds ? Update2: Perhaps it's not something readers want to hear but I ended up switching to Scala.,no
388,https://stackoverflow.com/questions/9424364,Update2,Can't compile project when I'm using Lombok under IntelliJ IDEA,I'm trying to use Lombok in my project that I'm developing using IntelliJ IDEA 11. I've installed 3rd-party plugin for IDEA and it seems working fine because IDEA sees all autogenerated methods/fields. So I have a class that uses Slf4j. I annotated it like this: -CODE- . But when I build my project compiler spits: cannot find symbol variable log. Could you please tell me what I'm missing here ? Update: It turned out it's RequestFactory annotation process that fails. -CODE- . Any ideas on workarounds ? Update2: Perhaps it's not something readers want to hear but I ended up switching to Scala.,no
389,https://stackoverflow.com/questions/9424364,Update2,Can't compile project when I'm using Lombok under IntelliJ IDEA,I'm trying to use Lombok in my project that I'm developing using IntelliJ IDEA 11. I've installed 3rd-party plugin for IDEA and it seems working fine because IDEA sees all autogenerated methods/fields. So I have a class that uses Slf4j. I annotated it like this: -CODE- . But when I build my project compiler spits: cannot find symbol variable log. Could you please tell me what I'm missing here ? Update: It turned out it's RequestFactory annotation process that fails. -CODE- . Any ideas on workarounds ? Update2: Perhaps it's not something readers want to hear but I ended up switching to Scala.,no
