	url	sentence	title	body	arbitration
904	https://stackoverflow.com/questions/5034442	The following code will print 2: -CODE- .	Indexes of all occurrences of character in a string	"The following code will print 2: -CODE- . I would like to know how to get all the indexes of ""n"" (""guess"") in the string ""bannanas"" The expected result would be: [2,3,5]"	no
905	https://stackoverflow.com/questions/9306202	"I am trying to learn regex, but in the meantime I need something to work now."	regex for matching something if it is not preceded by something else	"So with regex in java, I want to write a regex that will match if and only if the pattern is not preceded by certain characters. For example: -CODE- . I want to match if bar is not preceded by foo. So output would be: -CODE- . I know this is probably a very simple question. I am trying to learn regex, but in the meantime I need something to work now."	no
906	https://stackoverflow.com/questions/20734540	"I then, tried upgrading Hibernate with each Final release after 4.2.5."	NoSuchMethodError in javax.persistence.Table.indexes()[Ljavax/persistence/Index	"I have a Play Framework application and I was using Hibernate 4.2.5.Final (which is retrieved via the Maven dependency manager). I decided to upgrade to Hibernate 4.3.0.Final, recompile my application successfully, and ran it. I got the exception below, and haven't been able to figure out why. I downgraded back to 4.2.5 and this issue did not occur. I then, tried upgrading Hibernate with each Final release after 4.2.5. That is, I went from 4.2.5.Final to 4.2.6.Final, to 4.2.7.Final, to 4.2.8.Final and then to 4.3.Final. The issue does not occur until I upgrade to 4.3.0.Final. Java version information: -CODE- . And exception: -CODE- ."	no
907	https://stackoverflow.com/questions/2400955	but i have created tables using handwritten queries...	How to store Java Date to Mysql datetime...?	Can any body tell me how can I store Java Date to Mysql datetime...? When I am trying to do so...only date is stored and time remain 00:00:00 in Mysql date stores like this... -CODE- . I want not only date but also time...like : -CODE- . I am using JPA(Hibernate) with spring mydomain classes uses java.util.Date but i have created tables using handwritten queries... this is my create statement: -CODE- .	no
908	https://stackoverflow.com/questions/2776975	I tried to add 3 to foo3.	How can I add to List<? extends Number> data structures?	I have a List which is declared like this : -CODE- . I tried to add 3 to foo3. However I get an error message like this: -CODE- .	no
909	https://stackoverflow.com/questions/1783912	What am I doing wrong?	How to use BigInteger?	"I have this piece of code, which is not working: -CODE- . The sum variable is always 0. What am I doing wrong?"	no
910	https://stackoverflow.com/questions/17973970	What am I doing wrong here?	How to solve java.lang.NoClassDefFoundError?	"I've tried both the example in Oracle's Java Tutorials. They both compile fine, but at run-time, both come up with this error: -CODE- . I think I might have the Main.java file in the wrong folder. Here is the directory hierarchy: -CODE- . And here is Main.java: -CODE- . What am I doing wrong here? UPDATE. After I put put the Main class into the graphics package (I added package graphics; to it), set the classpath to ""_test"" (folder containing graphics), compiled it, and ran it using java graphics.Main (from the command line), it worked. Really late UPDATE #2. I wasn't using Eclipse (just Notepad++ and the JDK), and the above update solved my problem. However, it seems that many of these answers are for Eclipse and IntelliJ, but they have similar concepts."	no
911	https://stackoverflow.com/questions/15164864	What am I doing wrong?	How to accept Date params in a GET request to Spring MVC Controller?	I've a GET request that sends a date in YYYY-MM-DD format to a Spring Controller. The controller code is as follows: -CODE- . The request is sent correctly as I'm checking with Firebug. I get the error: -CODE- . How can I make the controller accept this format of Date? Please help. What am I doing wrong?	no
912	https://stackoverflow.com/questions/2654839	What am I doing wrong?	Rounding a double to turn it into an int (java)	Right now I'm trying this: -CODE- . where n is a double but it's not working. What am I doing wrong?	no
913	https://stackoverflow.com/questions/4832056	What am I doing wrong?	Java JDBC - How to connect to Oracle using Service Name instead of SID	"I have a Java application that uses JDBC (via JPA) that was connecting to a development database using hostname, port and Oracle SID, like this: jdbc:oracle:thin:@oracle.hostserver1.mydomain.ca:1521:XYZ. XYZ was the Oracle SID. Now I need to connect to a different Oracle database that does not use a SID, but uses an Oracle ""Service Name"" instead. I tried this but it doesn't work: jdbc:oracle:thin:@oracle.hostserver2.mydomain.ca:1522:ABCD. ABCD is the Service Name of the other database. What am I doing wrong?"	no
914	https://stackoverflow.com/questions/28294509	What am I doing wrong?	Accessing Kotlin extension functions from Java	"Is it possible to access extension functions from Java code? I defined the extension function in a Kotlin file. -CODE- . Where MyModel is a (generated) java class. Now, I wanted to access it in my normal java code: -CODE- . However, that doesn't work. The IDE won't recognize the bar() method and compilation fails. What does work is using with a static function from kotlin: -CODE- . by using import com.test.extensions.ExtensionsPackage so my IDE seems to be configured correctly. I searched through the whole Java-interop file from the kotlin docs and also googled a lot, but I couldn't find it. What am I doing wrong? Is this even possible?"	no
915	https://stackoverflow.com/questions/4318458	What am I doing wrong?	How to deserialize a list using GSON or another JSON library in Java?	"I can serialize a List in my servlet on GAE, but I can't deserialize it. What am I doing wrong? This is my class Video in GAE, which is serialized: -CODE- . This is my class Video in my other application, where I try to deserialize: -CODE- ."	no
916	https://stackoverflow.com/questions/5045608	What am I doing wrong?	Proper usage of Java -D command-line parameters	"When passing a -D parameter in Java, what is the proper way of writing the command-line and then accessing it from code? For example, I have tried writing something like this... -CODE- . And then calling it like this... -CODE- . But I receive a NullPointerException. What am I doing wrong?"	no
917	https://stackoverflow.com/questions/1729307	I am using Spring and in application-context.xml I have the following definitions: -CODE- .	Spring schemaLocation fails when there is no internet connection	"I am using Spring and in application-context.xml I have the following definitions: -CODE- . ..... When my internet connection is lost, I cannot run my application via tomcat or jetty. It gives: -CODE- . Any suggestions how to fix it?"	no
918	https://stackoverflow.com/questions/3144610	It can be forced to work by casting: -CODE- .	Integer division: How do you produce a double?	"For this code block: -CODE- . the value of d is 0.0. It can be forced to work by casting: -CODE- . But is there another way to get the correct double result? I don't like casting primitives, who knows what may happen."	no
919	https://stackoverflow.com/questions/29262002	The following Java code fails to compile: -CODE- .	Why does this Java 8 lambda fail to compile?	"The following Java code fails to compile: -CODE- . The compiler reports: -CODE- . The weird thing is that the line marked ""OK"" compiles fine, but the line marked ""Error"" fails. They seem essentially identical."	no
920	https://stackoverflow.com/questions/5387643	I can also write: -CODE- .	Array initialization syntax when not in a declaration	"I can write: -CODE- . I can also write: -CODE- . but I can't write: -CODE- . Why is this blocked by Java? I know how to work around it, but from time to time it would be simpler. For example: -CODE- . This simple question that has been bugging me since I learned how to play with arrays in Java."	no
921	https://stackoverflow.com/questions/10961714	I have IndexProcessorclass which implements the Runnable interface: -CODE- .	How to properly stop the Thread in Java?	"I need a solution to properly stop the thread in Java. I have IndexProcessorclass which implements the Runnable interface: -CODE- . And I have ServletContextListener class which starts and stops the thread: -CODE- . But when I shutdown tomcat, I get the exception in my IndexProcessor class: -CODE- . I am using JDK 1.6. So the question is: How can I stop the thread and not throw any exceptions? P.S. I do not want to use .stop(); method because it is deprecated."	no
922	https://stackoverflow.com/questions/14524751	"I also tried this one but it gave a runtime exception, ClassCastException: -CODE- ."	Cast Object to Generic Type for returning	"Is there a way to cast an object to return value of a method? I tried this way but it gave a compile time exception in ""instanceof"" part: -CODE- . I also tried this one but it gave a runtime exception, ClassCastException: -CODE- . Is there a possible way of doing this easily: -CODE- . EDIT: I wrote a working copy of the correct answer: -CODE- ."	no
923	https://stackoverflow.com/questions/21624592	I'm trying to compare 2 lists: -CODE- .	Hamcrest compare collections	I'm trying to compare 2 lists: -CODE- . But idea : -CODE- . How should I write it?	yes
924	https://stackoverflow.com/questions/10904911	My code: -CODE- .	How to convert an int array to String with toString method in Java	"I am using trying to use the toString(int[]) method, but I think I am doing it wrong: http://docs.oracle.com/javase/1.5.0/docs/api/java/util/Arrays.html#toString(int[]) My code: -CODE- . The output is: -CODE- . Also I tried printing like this, but: -CODE- . I took this code out of bigger and more complex code, but I can add it if needed. But this should give general information. I am looking for output, like in Oracle's documentation: -CODE- ."	no
925	https://stackoverflow.com/questions/5614562	This Java code: -CODE- .	How to do the equivalent of pass by reference for primitives in Java	"This Java code: -CODE- . will output this: -CODE- . In C++ I can pass the toyNumber variable as pass by reference to avoid shadowing i.e. creating a copy of the same variable as below: -CODE- . and the C++ output will be this: -CODE- . My question is - What's the equivalent code in Java to get the same output as the C++ code, given that Java is pass by value rather than pass by reference?"	no
926	https://stackoverflow.com/questions/5928225	How to make pipes work with Runtime.exec()?	How to make pipes work with Runtime.exec()?	"Consider the following code: -CODE- . The program's output is: -CODE- . When I run from the shell, of course, it works as expected: -CODE- . The internets tell me that, due to the fact that pipe behavior isn't cross-platform, the brilliant minds who work in the Java factory producing Java can't guarantee that pipes work. How can I do this? I am not going to do all of my parsing using Java constructs rather than grep and sed, because if I want to change the language, I'll be forced to re-write my parsing code in that language, which is totally a no-go. How can I make Java do piping and redirection when calling shell commands?"	no
927	https://stackoverflow.com/questions/10714233	I am trying to do this with : -CODE- .	Remove Item from ArrayList	"I have an ArrayList suppose list, and it has 8 items A-H and now I want to delete 1,3,5 position Item stored in int array from the list how can I do this. I am trying to do this with : -CODE- . But after first item deleted positioned of array is changed and in the next iterate it deletes wrong element or give exception."	no
928	https://stackoverflow.com/questions/4000169	"I’ve successfully done this, using the following code: -CODE- ."	Getting the array length of a 2D array in Java	"I need to get the length of a 2D array for both the row and column. I’ve successfully done this, using the following code: -CODE- . This prints out 5, 10 as expected. Now take a look at this line: -CODE- . Notice that I actually have to reference a particular row, in order to get the column length. To me, this seems incredibly ugly. Additionally, if the array was defined as: -CODE- . Then the code would fail when trying to get the length. Is there a different (more intelligent) way to do this?"	no
929	https://stackoverflow.com/questions/28294509	What does work is using with a static function from kotlin: -CODE- .	Accessing Kotlin extension functions from Java	"Is it possible to access extension functions from Java code? I defined the extension function in a Kotlin file. -CODE- . Where MyModel is a (generated) java class. Now, I wanted to access it in my normal java code: -CODE- . However, that doesn't work. The IDE won't recognize the bar() method and compilation fails. What does work is using with a static function from kotlin: -CODE- . by using import com.test.extensions.ExtensionsPackage so my IDE seems to be configured correctly. I searched through the whole Java-interop file from the kotlin docs and also googled a lot, but I couldn't find it. What am I doing wrong? Is this even possible?"	no
930	https://stackoverflow.com/questions/1080904	I've tried the following code	How can I lookup a Java enum from its String value?	I would like to lookup an enum from its string value (or possibly any other value). I've tried the following code but it doesn't allow static in initialisers. Is there a simple way? -CODE- .	no
931	https://stackoverflow.com/questions/44088493	The application is build with the following dependencies with gradle: -CODE- .	Jersey stopped working with InjectionManagerFactory not found	I am receiving below error while running my Jersey API in Tomcat 8.5.11 which is causing my API to stop: -CODE- . The application is build with the following dependencies with gradle: -CODE- . This downloads jersey-common-2.26-b04.jar which contains the missing class under /org/glassfish/jersey/internal/inject/InjectionManagerFactory. The jar file is deployed into the Tomcat folder under WEB-INF/lib. What can be wrong here? The gradle script worked the last few month with the same Tomcat version.	no
932	https://stackoverflow.com/questions/32807587	also add this to project build gradle: -CODE- . also add plugin to app build gradle: -CODE- .	com.android.build.transform.api.TransformException	"i am trying to integrate google sign in , in my app,i added these libraries: -CODE- . also add this to project build gradle: -CODE- . also add plugin to app build gradle: -CODE- . then add required permissions but when i try to run my app , received this error: -CODE- ."	no
933	https://stackoverflow.com/questions/9027317	format - -CODE- .	"How to convert milliseconds to ""hh:mm:ss"" format?"	"I'm confused. After stumbling upon this thread, I tried to figure out how to format a countdown timer that had the format hh:mm:ss. Here's my attempt - -CODE- . So, when I try a value like 3600000ms, I get 01:59:00, which is wrong since it should be 01:00:00. Obviously there's something wrong with my logic, but at the moment, I cannot see what it is! Can anyone help? Edit - Fixed it. Here's the right way to format milliseconds to hh:mm:ss format - -CODE- . The problem was this TimeUnit.MINUTES.toMinutes(TimeUnit.MILLISECONDS.toHours(millis)). It should have been this TimeUnit.HOURS.toMinutes(TimeUnit.MILLISECONDS.toHours(millis)) instead."	no
934	https://stackoverflow.com/questions/953723	whereas tutorials seem to prefer: -CODE- .	What's the point of JAXB 2's ObjectFactory classes?	"I'm new to using JAXB, and I used JAXB 2.1.3's xjc to generate a set of classes from my XML Schema. In addition to generating a class for each element in my schema, it created an ObjectFactory class. There doesn't seem to be anything stopping me from instantiating the elements directly, e.g. -CODE- . whereas tutorials seem to prefer: -CODE- . If I look into ObjectFactory.java, I see: -CODE- . so what's the deal? Why should I even bother keeping the ObjectFactory class around? I assume it will also be overwritten if I were to re-compile from an altered schema."	no
935	https://stackoverflow.com/questions/10904911	"I am using trying to use the toString(int[]) method, but I think I am doing it wrong: http://docs.oracle.com/javase/1.5.0/docs/api/java/util/Arrays.html#toString(int[])"	How to convert an int array to String with toString method in Java	"I am using trying to use the toString(int[]) method, but I think I am doing it wrong: http://docs.oracle.com/javase/1.5.0/docs/api/java/util/Arrays.html#toString(int[]) My code: -CODE- . The output is: -CODE- . Also I tried printing like this, but: -CODE- . I took this code out of bigger and more complex code, but I can add it if needed. But this should give general information. I am looking for output, like in Oracle's documentation: -CODE- ."	no
936	https://stackoverflow.com/questions/19112357	I have SimpleDateFormat constructor as : -CODE- .	"Java SimpleDateFormat(""yyyy-MM-dd'T'HH:mm:ss'Z'"") gives timezone as IST"	"I have SimpleDateFormat constructor as : -CODE- . and I am parsing string ""2013-09-29T18:46:19Z"". I have read that here Z represents the GMT/UTC timezone. but when I print this date on console , It prints IST timezne for the returned date. Now my question is whether my output is right or wrong?"	no
937	https://stackoverflow.com/questions/4148231	I have : -CODE- .	How can i get the session object if i have the entitymanager	I have : -CODE- . How can i retrieve the session if am using entitymanager or how can i get the result from my detachedcriteria ?	no
938	https://stackoverflow.com/questions/32623834	Above code will print: -CODE- .	How does this Java code snippet work? (String pool and reflection)	Java string pool coupled with reflection can produce some unimaginable result in Java: -CODE- . Above code will print: -CODE- . What happened to Mario?	no
939	https://stackoverflow.com/questions/4110664	I've tried the following	Gson: Directly convert String to JsonObject (no POJO)	"Can't seem to figure this out. I'm attempting JSON tree manipulation in GSON, but I have a case where I do not know or have a POJO to convert a string into, prior to converting to JsonObject. Is there a way to go directly from a String to JsonObject? I've tried the following (Scala syntax): -CODE- . but a fails, the JSON is escaped and parsed as a JsonString only, and b returns an empty JsonObject. Any ideas?"	no
940	https://stackoverflow.com/questions/2222560	I even tried to modify the plugin : -CODE- .	maven build failed: Unable to locate the Javac Compiler in: jre or jdk issue	"I have my JAVA_HOME set to : -CODE- . After I run maven install I get this message from eclipse: Reason: -CODE- . I'm certain that this is the tricky part : -CODE- . When I run configuration its set to JRE6, how do I change it to JDK 1.6 which I have already installed. EDIT. I even tried to modify the plugin : -CODE- . Still I get the same error. Maybe I forgot to say I use eclipse maven plugin .. how can I change from JRE to JDK in eclipse ?"	no
941	https://stackoverflow.com/questions/21132692	"Forgot to mention, but I am using Java 7."	Java unchecked: unchecked generic array creation for varargs parameter	"I have set Netbeans to show unchecked warnings in my Java code, but I am failing to understand the error on the following lines: -CODE- . Gives: [unchecked] unchecked generic array creation for varargs parameter of type List<String>[] Method source: -CODE- . What is exactly going wrong and how would I fix it, as I suppose leaving unchecked warnings in the code is not a good idea? Forgot to mention, but I am using Java 7. Edit: Also I see now that the method has the following: -CODE- ."	no
942	https://stackoverflow.com/questions/30118683	I have the following properties in application.properties: -CODE- .	How to log SQL statements in Spring Boot?	I want to log SQL statements in a file. I have the following properties in application.properties: -CODE- . When I run my application : -CODE- . I can see sql statements in the console but they don't appear in a file app.log. The file contains only basic logs from spring. What should I do to see sql statements in the log file?	no
943	https://stackoverflow.com/questions/23068676	-CODE- .	"How to get current timestamp in string format in Java? ""yyyy.MM.dd.HH.mm.ss"""	"How to get timestamp in string format in Java? ""yyyy.MM.dd.HH.mm.ss"" -CODE- . This is what I have, but Timestamp() requires an parameters..."	no
944	https://stackoverflow.com/questions/9043981	-CODE- .	How to add minutes to my Date	"I have this date object: -CODE- . value of d1 is Fri Jan 07 17:40:00 PKT 2011. Now I am trying to add 10 minutes to the date above. -CODE- . Value of newTime changes to 2011-50-07 17:50 but it should be 07-01-2011 17:50. It adds minutes correctly but it also changes month, don't know why!"	no
945	https://stackoverflow.com/questions/6029495	-CODE- .	How can I generate random number in specific range in Android?	" -CODE- . I want to generate random number in a specific range. (Ex. Range Between 65 to 80) I try as per below code, but it is not very use full. It also returns the value greater then max. value(greater then 80). -CODE- . How can I generate random number in between range?"	no
946	https://stackoverflow.com/questions/23069370	It throws: -CODE- .	Format a date using the new date time API	"I was playing with the new date time API but when running this: -CODE- . It throws: -CODE- . When looking at the source code of the LocalDate class, I see: -CODE- . As it described in the doc: -CODE- . And all these letters are defined. So why DateTimeFormatter.ofPattern doesn't allow us to use some pattern letters?"	no
947	https://stackoverflow.com/questions/25953819	-CODE- .	How to set connection timeout with OkHttp	I am developing app using OkHttp library and my trouble is I cannot find how to set connection timeout and socket timeout. -CODE- . Thanks.	no
948	https://stackoverflow.com/questions/1509391	-CODE- .	how to get the one entry from hashmap without iterating	"Is there a elegant way of obtaining only one Entry<K,V> from HashMap, without iterating, if key is not known. As order of entry of entry is not important, can we say something like: -CODE- . Although I am aware that there exist no such get by index method. If I tried approach mentioned below, it would still have to get all the entry set of the hashmap. -CODE- . Suggestions are welcome. EDIT: Please suggest any other Data Structure to suffice requirement."	no
949	https://stackoverflow.com/questions/4917326	-CODE- .	"How to iterate over the files of a certain directory, in Java?"	 -CODE- . I want to process each file in a certain directory using Java. What is the easiest (and most common) way of doing this?	no
950	https://stackoverflow.com/questions/1181969	Example: -CODE- .	Java: Get last element after split	I am using the String split method and I want to have the last element. The size of the Array can change. Example: -CODE- . I want to split the above Strings and get the last item: -CODE- . I don't know the sizes of the arrays at runtime :(	no
951	https://stackoverflow.com/questions/2503628	it never returns Bitmaps.	BitmapFactory.decodeStream returning null when options are set	"I'm having issues with BitmapFactory.decodeStream(inputStream). When using it without options, it will return an image. But when I use it with options as in .decodeStream(inputStream, null, options) it never returns Bitmaps. What I'm trying to do is to downsample a Bitmap before I actually load it to save memory. I've read some good guides, but none using .decodeStream. [1]Handling large Bitmaps. [2]And here. [3]Image Processing in Android. WORKS JUST FINE: -CODE- . DOESN'T WORK: -CODE- ."	no
952	https://stackoverflow.com/questions/14414582	Java split string to array	Java split string to array	"I need help with the split() method. I have the followingString: -CODE- . I need to put the values into an array. There are 3 possible strings: ""0"", ""1"", and """" My problem is, when i try to use split(): -CODE- . My values are saved only until the last 0. Seems like the part ""|||"" gets trimmed. What am i doing wrong? thanks."	yes
953	https://stackoverflow.com/questions/5815423	I want the result as: -CODE- .	Sorting arraylist in alphabetical order (case insensitive)	I have a string arraylist names which contains names of people. I want to sort the arraylist in alphabetical order. -CODE- . I tried to sort the list in above way. But it is displaying the sorted array as: -CODE- . but I don't want to make it case sensitive. I want the result as: -CODE- .	yes
954	https://stackoverflow.com/questions/17135496	but it is not working either.	WhatsApp API (java/python)	"I am looking for WhatsApp API, preferably a Python or Java library. I've tried Yowsup, but could not get my number registered; I am based in India and I am not sure if that has got anything to do with it. I did try WhatsAPI (Python library) but it is not working either. Any suggestions about this? Any users of Yowsup here?"	no
955	https://stackoverflow.com/questions/5585919	I want to display a Unicode character in Java.	Creating Unicode character from its number	"I want to display a Unicode character in Java. If I do this, it works just fine: String symbol = ""\u2202""; symbol is equal to ""?. That's what I want. The problem is that I know the Unicode number and need to create the Unicode symbol from that. I tried (to me) the obvious thing: -CODE- . However, in this case, symbol is equal to \""\\u2202\"". That's not what I want. How can I construct the symbol if I know its Unicode number (but only at run-time---I can't hard-code it in like the first example)?"	yes
