	url	sentence	title	body	arbitration
282	https://stackoverflow.com/questions/4246646	"In fact, every time risultato ="	MySQL & Java - Get id of the last inserted value (JDBC)	" -CODE- . Hi, I'm using JDBC to connect on database through out Java. Now, I do some insert query, and I need to get the id of last inserted value (so, after a stmt.executeUpdate). I don't need something like SELECT id FROM table ORDER BY id DESC LIMIT 1, because I may have concurrency problems. I Just need to retrieve the id associated to the last insertion (about my instance of the Statement). I tried this, but seems it doesn't work on JDBC : -CODE- . In fact, every time risultato = -1, and I get java.sql.SQLException: Generated keys not requested. You need to specify Statement.RETURN_GENERATED_KEYS to Statement.executeUpdate() or Connection.prepareStatement(). How can I fix this problem? Thanks Stackoverflow People :)"	no
283	https://stackoverflow.com/questions/4066424	"I google it for solutions and have tried to export MAVEN_OPTS=-Xmx1024m, but it did not work."	java.lang.OutOfMemoryError: Java heap space in Maven	"When I run maven test, java.lang.OutOfMemoryError happens. I google it for solutions and have tried to export MAVEN_OPTS=-Xmx1024m, but it did not work. Anyone know other solutions for this problem ,BTW I am using maven 3.0. Thanks in advance. Paste the error message here when run ""mvn test -e"" -CODE- ."	no
284	https://stackoverflow.com/questions/5606541	Is there a way to capture a list of specific type using mockitos ArgumentCaptore.	How to capture a list of specific type with mockito	Is there a way to capture a list of specific type using mockitos ArgumentCaptore. This doesn't work: -CODE- .	yes
285	https://stackoverflow.com/questions/11701399	i am using math.round() to round off.	round up to 2 decimal places in java?	I have read a lot of stackoverflow questions but none seems to be working for me. i am using math.round() to round off. this is the code: -CODE- . the output i get is: 123 but i want it to be 123.14. i read that adding *100/100 will help but as you can see i didn't manage to get it to work. it is absolutely essential for both input and output to be a double. it would be great great help if you change the line 4 of the code above and post it.	no
286	https://stackoverflow.com/questions/11701399	the output i get is: 123	round up to 2 decimal places in java?	I have read a lot of stackoverflow questions but none seems to be working for me. i am using math.round() to round off. this is the code: -CODE- . the output i get is: 123 but i want it to be 123.14. i read that adding *100/100 will help but as you can see i didn't manage to get it to work. it is absolutely essential for both input and output to be a double. it would be great great help if you change the line 4 of the code above and post it.	no
287	https://stackoverflow.com/questions/4050087	And I have to obtain the id I have tried with this: -CODE- .	How to obtain the last path segment of an uri	I have in input a string that is an URI. how is possible to get the last path segment? that in my case is an id? This is my input url : -CODE- . And I have to obtain the id I have tried with this: -CODE- . but it doesn't work and for sure there is a better way to do it.	no
288	https://stackoverflow.com/questions/2673855	The second example should read: c:(double-backslash)afolder(double-backslash)aFile.	Java equivalent of C#'s verbatim strings with @	"Quick question. Is there an equivalent of @ as applied to strings in Java: For example I can do @""c:\afolder\afile"" in C# and have it ignore the escape characters when processing instead of having to do ""c:\\afolder\\aFile"". Is there a Java equivalent? hmmm: stackoverflow is escaping on me .. lol. The second example should read: c:(double-backslash)afolder(double-backslash)aFile."	no
289	https://stackoverflow.com/questions/1805518	I tried using this but didn't work- -CODE- .	Replacing all non-alphanumeric characters with empty strings	I tried using this but didn't work- -CODE- .	no
290	https://stackoverflow.com/questions/18339707	I have installed JDK 8 and trying to run Eclipse.	PermGen elimination in JDK 8	I have installed JDK 8 and trying to run Eclipse. I am getting following warning message: -CODE- . What are the reasons of ignoring this argument?	no
291	https://stackoverflow.com/questions/12045568	I am trying to create 2 versions of an Android app (free/paid).	Jar Mismatch Found 2 versions of android-support-v4.jar in the dependency list	I am trying to create 2 versions of an Android app (free/paid). I have an Android Library that contains files common to both. I created a new Android project and am trying to use the Library but get the error below: -CODE- . Any ideas on how to resolve this? I've been playing with the build path to no success.	no
292	https://stackoverflow.com/questions/7032070	Are there any caveats in using arraylist.removeAll(arraylist) instead of arraylist.clear()?	What is the difference between ArrayList.clear() and ArrayList.removeAll()?	"Assuming that arraylist is defined as ArrayList<String> arraylist, is arraylist.removeAll(arraylist) equivalent to arraylist.clear()? If so, can I assume that the clear() method is more efficient for emptying the array list? Are there any caveats in using arraylist.removeAll(arraylist) instead of arraylist.clear()?"	no
293	https://stackoverflow.com/questions/6524196	Java - get pixel array from image	Java - get pixel array from image	"I'm looking for the fastest way to get pixel data (int the form int[][]) from a BufferedImage. My goal is to be able to address pixel (x, y) from the image using int[x][y]. All the methods I have found do not do this (most of them return int[]s)."	yes
294	https://stackoverflow.com/questions/19418427	"The comparison expression concat==""string"" returns false as obvious (I understand the difference between equals() and ="	Comparing strings with == which are declared final in Java	"I have a simple question about strings in Java. The following segment of simple code just concatenates two strings and then compares them with ==. -CODE- . The comparison expression concat==""string"" returns false as obvious (I understand the difference between equals() and ==). When these two strings are declared final like so, -CODE- . The comparison expression concat==""string"", in this case returns true. Why does final make a difference? Does it have to do something with the intern pool or I'm just being misled?"	no
295	https://stackoverflow.com/questions/19418427	"The comparison expression concat==""string"", in this case returns true."	Comparing strings with == which are declared final in Java	"I have a simple question about strings in Java. The following segment of simple code just concatenates two strings and then compares them with ==. -CODE- . The comparison expression concat==""string"" returns false as obvious (I understand the difference between equals() and ==). When these two strings are declared final like so, -CODE- . The comparison expression concat==""string"", in this case returns true. Why does final make a difference? Does it have to do something with the intern pool or I'm just being misled?"	no
296	https://stackoverflow.com/questions/527703	How can I get stock quotes using Google Finance API?	How can I get stock quotes using Google Finance API?	I'm looking for access to financial data from Google services. I found this URL that gets the stock data for Microsoft. What are all the possible parameters that Google allows for this kind of HTTP request? I'd like to see all the different information that I could get.	no
297	https://stackoverflow.com/questions/1363310	My broken test is: -CODE- .	Auto-wiring a List using util schema gives NoSuchBeanDefinitionException	"I have a bean that i want to inject with a named list using Spring util namespace <util:list id=""myList""> but Spring is looking for a collection of beans of type String instead. My broken test is: -CODE- . My context is: -CODE- . But I get : -CODE- . Which puzzles me rather as I figured this would be the way it was expected to work."	no
298	https://stackoverflow.com/questions/1363310	My context is: -CODE- .	Auto-wiring a List using util schema gives NoSuchBeanDefinitionException	"I have a bean that i want to inject with a named list using Spring util namespace <util:list id=""myList""> but Spring is looking for a collection of beans of type String instead. My broken test is: -CODE- . My context is: -CODE- . But I get : -CODE- . Which puzzles me rather as I figured this would be the way it was expected to work."	no
299	https://stackoverflow.com/questions/1363310	But I get : -CODE- .	Auto-wiring a List using util schema gives NoSuchBeanDefinitionException	"I have a bean that i want to inject with a named list using Spring util namespace <util:list id=""myList""> but Spring is looking for a collection of beans of type String instead. My broken test is: -CODE- . My context is: -CODE- . But I get : -CODE- . Which puzzles me rather as I figured this would be the way it was expected to work."	no
300	https://stackoverflow.com/questions/1445233	does not work since you cannot create generic arrays.	"Is it possible to solve the ""A generic array of T is created for a varargs parameter"" compiler warning?"	"This is a simplified version of the code in question, one generic class uses another class with generic type parameters and needs to pass one of the generic types to a method with varargs parameters: -CODE- . } Is there any correct way to pass along the generic parameter to a varargs method without encountering this warning? Of course something like : -CODE- . does not work since you cannot create generic arrays."	no
301	https://stackoverflow.com/questions/44322178	I am using Android Database Component Room.	Room - Schema export directory is not provided to the annotation processor so we cannot export the schema	"I am using Android Database Component Room. I've configured everything, but when I compile, Android Studio gives me this warning: -CODE- . As I understand it is location where DB file will be located. How can it affect my app ? What is best practice here ? Should I use default location (false value) ?"	no
302	https://stackoverflow.com/questions/44322178	"I've configured everything, but when I compile, Android Studio gives me this warning: -CODE- ."	Room - Schema export directory is not provided to the annotation processor so we cannot export the schema	"I am using Android Database Component Room. I've configured everything, but when I compile, Android Studio gives me this warning: -CODE- . As I understand it is location where DB file will be located. How can it affect my app ? What is best practice here ? Should I use default location (false value) ?"	no
303	https://stackoverflow.com/questions/2149785	Get size of folder or file	Get size of folder or file	How can I retrieve size of folder or file in Java?	no
304	https://stackoverflow.com/questions/2149785	How can I retrieve size of folder or file in Java?	Get size of folder or file	How can I retrieve size of folder or file in Java?	no
305	https://stackoverflow.com/questions/4509086	in this case query will be generated like this: -CODE- .	What is the difference between persist() and merge() in JPA and Hibernate?	"What is the difference between persist() and merge() in Hibernate? persist() can create a UPDATE & INSERT query, eg: -CODE- . in this case query will be generated like this: -CODE- . so persist() method can generate an Insert and an Update. Now with merge(): -CODE- . This is what I see in the database: -CODE- . Now update a record using merge() -CODE- . This is what I see in the database: -CODE- ."	no
306	https://stackoverflow.com/questions/2248131	Each of the tasks has many places during which it may fail due to exceptions.	Handling exceptions from Java ExecutorService tasks	"I'm trying to use Java's ThreadPoolExecutor class to run a large number of heavy weight tasks with a fixed number of threads. Each of the tasks has many places during which it may fail due to exceptions. I've subclassed ThreadPoolExecutor and I've overridden the afterExecute method which is supposed to provide any uncaught exceptions encountered while running a task. However, I can't seem to make it work. For example: -CODE- . The output from this program is ""Everything's fine--situation normal!"" even though the only Runnable submitted to the thread pool throws an exception. Any clue to what's going on here? Thanks!"	no
307	https://stackoverflow.com/questions/2248131	For example: -CODE- .	Handling exceptions from Java ExecutorService tasks	"I'm trying to use Java's ThreadPoolExecutor class to run a large number of heavy weight tasks with a fixed number of threads. Each of the tasks has many places during which it may fail due to exceptions. I've subclassed ThreadPoolExecutor and I've overridden the afterExecute method which is supposed to provide any uncaught exceptions encountered while running a task. However, I can't seem to make it work. For example: -CODE- . The output from this program is ""Everything's fine--situation normal!"" even though the only Runnable submitted to the thread pool throws an exception. Any clue to what's going on here? Thanks!"	no
308	https://stackoverflow.com/questions/2248131	"The output from this program is ""Everything's fine--situation normal!"""	Handling exceptions from Java ExecutorService tasks	"I'm trying to use Java's ThreadPoolExecutor class to run a large number of heavy weight tasks with a fixed number of threads. Each of the tasks has many places during which it may fail due to exceptions. I've subclassed ThreadPoolExecutor and I've overridden the afterExecute method which is supposed to provide any uncaught exceptions encountered while running a task. However, I can't seem to make it work. For example: -CODE- . The output from this program is ""Everything's fine--situation normal!"" even though the only Runnable submitted to the thread pool throws an exception. Any clue to what's going on here? Thanks!"	no
309	https://stackoverflow.com/questions/3657157	Consider the code: -CODE- .	How do I get a file's directory using the File object?	"Consider the code: -CODE- . testfile is a file, and it may or may not exist. I want to get the directory c:\\temp\\java\\ using the File object. How do I go about doing this?"	no
310	https://stackoverflow.com/questions/3657157	I want to get the directory c:\\temp\\java\\ using the File object.	How do I get a file's directory using the File object?	"Consider the code: -CODE- . testfile is a file, and it may or may not exist. I want to get the directory c:\\temp\\java\\ using the File object. How do I go about doing this?"	no
311	https://stackoverflow.com/questions/21417419	"I tried to use it in my IDEA IDE, but it couldn't see it."	How to convert AAR to JAR	"Situation: I intend to use a Java library and I only have an AAR file from a Maven repository but I need the JAR file. Background story: I tried to compile a library, but its Gradle structure was unstable. So I asked for a compiled jar file, and its developer handed me an aar file from some Maven repository (the developer couldn't compile his own project). The Gradle configuration was a mess, it depended on multiple libraries and Gradle has thrown some exceptions. I tried to use it in my IDEA IDE, but it couldn't see it. A library project should be able to be compiled into a jar file, right? Question: What should I do to convert that AAR file to a JAR file?"	no
312	https://stackoverflow.com/questions/9424364	I annotated it like this: -CODE- .	Can't compile project when I'm using Lombok under IntelliJ IDEA	I'm trying to use Lombok in my project that I'm developing using IntelliJ IDEA 11. I've installed 3rd-party plugin for IDEA and it seems working fine because IDEA sees all autogenerated methods/fields. So I have a class that uses Slf4j. I annotated it like this: -CODE- . But when I build my project compiler spits: cannot find symbol variable log. Could you please tell me what I'm missing here ? Update: It turned out it's RequestFactory annotation process that fails. -CODE- . Any ideas on workarounds ? Update2: Perhaps it's not something readers want to hear but I ended up switching to Scala.	no
313	https://stackoverflow.com/questions/32820722	but I cannot understand the construction: -CODE- .	What does lambda with 2 arrows mean in Java 8?	"I have read several Java 8 tutorials before. Right now I encountered following topic: Does java support Currying? Here, I see following code: -CODE- . I understand that this example sum 2 elements but I cannot understand the construction: -CODE- . According to the left part of expression, this row should implement following function: -CODE- . Before this, I only met lambdas only with one arrow."	no
314	https://stackoverflow.com/questions/16748030	where ia is array of integers.	Difference between Arrays.asList(array) and new ArrayList<Integer>(Arrays.asList(array))	"What is the difference between : -CODE- . where ia is array of integers. I came to know that some operations are not allowed in list2. why is it so? how is it stored in memory (references / copy)? When I shuffle the lists, list1 doesn't affect the original array but list2 does. But still list2 is somewhat confusing. How ArrayList being upcasted to list differs from creating new ArrayList: -CODE- ."	no
315	https://stackoverflow.com/questions/16748030	"When I shuffle the lists, list1 doesn't affect the original array but list2 does."	Difference between Arrays.asList(array) and new ArrayList<Integer>(Arrays.asList(array))	"What is the difference between : -CODE- . where ia is array of integers. I came to know that some operations are not allowed in list2. why is it so? how is it stored in memory (references / copy)? When I shuffle the lists, list1 doesn't affect the original array but list2 does. But still list2 is somewhat confusing. How ArrayList being upcasted to list differs from creating new ArrayList: -CODE- ."	no
316	https://stackoverflow.com/questions/839178	Why is Java's Iterator not an Iterable?	Why is Java's Iterator not an Iterable?	Why does the Iterator interface not extend Iterable? The iterator() method could simply return this. Is it on purpose or just an oversight of Java's designers? It would be convenient to be able to use a for-each loop with iterators like this: -CODE- . where listSomeObjects() returns an iterator.	no
317	https://stackoverflow.com/questions/839178	where listSomeObjects() returns an iterator.	Why is Java's Iterator not an Iterable?	Why does the Iterator interface not extend Iterable? The iterator() method could simply return this. Is it on purpose or just an oversight of Java's designers? It would be convenient to be able to use a for-each loop with iterators like this: -CODE- . where listSomeObjects() returns an iterator.	no
318	https://stackoverflow.com/questions/888335	"I think that first one is cooler, but many times I saw people using the second option."	Why generate long serialVersionUID instead of a simple 1L?	"When class implements Serializable in Eclipse, I have two options: add default serialVersionUID(1L) or generated serialVersionUID(3567653491060394677L). I think that first one is cooler, but many times I saw people using the second option. Is there any reason to generate long serialVersionUID?"	no
319	https://stackoverflow.com/questions/1199646	This can only be done by text.	Long list of if statements in Java	"Sorry I can't find a question answering this, I'm almost certain someone else has raised it before. My problem is that I'm writing some system libraries to run embedded devices. I have commands which can be sent to these devices over radio broadcasts. This can only be done by text. inside the system libraries I have a thread which handles the commands which looks like this: -CODE- . The problem is that there are a lot of commands to it will quickly spiral to something out of control. Horrible to look out, painful to debug and mind boggling to understand in a few months time."	no
320	https://stackoverflow.com/questions/609826	How much is read from ThreadLocal variable slower than from regular field?	Performance of ThreadLocal variable	"How much is read from ThreadLocal variable slower than from regular field? More concretely is simple object creation faster or slower than access to ThreadLocal variable? I assume that it is fast enough so that having ThreadLocal<MessageDigest> instance is much faster then creating instance of MessageDigest every time. But does that also apply for byte[10] or byte[1000] for example? Edit: Question is what is really going on when calling ThreadLocal's get? If that is just a field, like any other, then answer would be ""it's always fastest"", right?"	no
321	https://stackoverflow.com/questions/22007341	I am using Spring JPA to perform all database operations.	Spring JPA selecting specific columns	"I am using Spring JPA to perform all database operations. However I don't know how to select specific columns from a table in Spring JPA? For example: SELECT projectId, projectName FROM projects."	no
322	https://stackoverflow.com/questions/22007341	"For example: SELECT projectId, projectName FROM projects."	Spring JPA selecting specific columns	"I am using Spring JPA to perform all database operations. However I don't know how to select specific columns from a table in Spring JPA? For example: SELECT projectId, projectName FROM projects."	no
323	https://stackoverflow.com/questions/1297972	"The best solution I can think of is to define separate interfaces, e.g. -CODE- ."	How to make a Java class that implements one interface with two generic types?	"I have a generic interface: -CODE- . I have a class that consumes two types of objects, so I would like to do something like: -CODE- . Apparently I can't do that. I can of course implement the dispatch myself, e.g. -CODE- . But I am looking for the compile-time type-checking and dispatching solution that generics provide. The best solution I can think of is to define separate interfaces, e.g. -CODE- . Functionally, this solution is OK, I think. It's just verbose and ugly. Any ideas?"	no
324	https://stackoverflow.com/questions/5131867	For example: -CODE- .	Removing the first 3 characters from a string	What is the most efficient way to remove the first 3 characters of a string? For example: -CODE- .	no
325	https://stackoverflow.com/questions/13012584	Now I want to convert the result object to java POJO class which contains the same five Strings.	JPA : How to convert a native query result set to POJO class collection	"I am using JPA in my project. I came to a query in which I need to make join operation on five tables. So I created a native query which returns five fields. Now I want to convert the result object to java POJO class which contains the same five Strings. Is there any way in JPA to directly cast that result to POJO object list ?? I came to the following solution .. -CODE- . Now here in resultClass, do we need to provide a class which is actual JPA entity ? OR We can convert it to any JAVA POJO class which contains the same column names ?"	no
326	https://stackoverflow.com/questions/13012584	Is there any way in JPA to directly cast that result to POJO object list ??	JPA : How to convert a native query result set to POJO class collection	"I am using JPA in my project. I came to a query in which I need to make join operation on five tables. So I created a native query which returns five fields. Now I want to convert the result object to java POJO class which contains the same five Strings. Is there any way in JPA to directly cast that result to POJO object list ?? I came to the following solution .. -CODE- . Now here in resultClass, do we need to provide a class which is actual JPA entity ? OR We can convert it to any JAVA POJO class which contains the same column names ?"	no
327	https://stackoverflow.com/questions/5328518	The current URL is http://localhost:8080/	Deploying my application at the root in Tomcat	I have the war file of my application. I need to deploy this at the root level. The current URL is http://localhost:8080/war_name/application_name.	no
328	https://stackoverflow.com/questions/3559063	"I want to initialize a String in Java, but that string needs to include quotes; for example: ""ROM""."	How to enter quotes in a Java string?	"I want to initialize a String in Java, but that string needs to include quotes; for example: ""ROM"". I tried doing: -CODE- . but that doesn't work. How can I include ""s within a string?"	yes
329	https://stackoverflow.com/questions/3559063	I tried doing: -CODE- .	How to enter quotes in a Java string?	"I want to initialize a String in Java, but that string needs to include quotes; for example: ""ROM"". I tried doing: -CODE- . but that doesn't work. How can I include ""s within a string?"	no
330	https://stackoverflow.com/questions/1855170	So i tried this: -CODE- .	When should we use intern method of String on String literals	"According to String#intern(), intern method is supposed to return the String from the String pool if the String is found in String pool, otherwise a new string object will be added in String pool and the reference of this String is returned. So i tried this: -CODE- . I was expecting that s1 and s3 are same will be printed as s3 is interned, and s1 and s2 are same will not be printed. But the result is: both lines are printed. So that means, by default String constants are interned. But if it is so, then why do we need the intern method? In other words when should we use this method?"	no
