	url	sentence	title	body	arbitration
0	https://stackoverflow.com/questions/24641536	"java -version gives me: [1]java version ""1.7.0_55""."	How to set JAVA_HOME in Linux for all users	"I am new to Linux system and there seem to be too many Java folders. java -version gives me: [1]java version ""1.7.0_55"". [2]OpenJDK Runtime Environment (rhel-2.4.7.1.el6_5-x86_64 u55-b13). [3]OpenJDK 64-Bit Server VM (build 24.51-b03, mixed mode). When I am trying to build a Maven project , I am getting error: -CODE- . Could you please tell me which files I need to modify for root as well as not-root user and where exactly is java located?"	no
1	https://stackoverflow.com/questions/23068676	How to get current timestamp in string format in Java?	"How to get current timestamp in string format in Java? ""yyyy.MM.dd.HH.mm.ss"""	"How to get timestamp in string format in Java? ""yyyy.MM.dd.HH.mm.ss"" -CODE- . This is what I have, but Timestamp() requires an parameters..."	no
2	https://stackoverflow.com/questions/23068676	How to get timestamp in string format in Java?	"How to get current timestamp in string format in Java? ""yyyy.MM.dd.HH.mm.ss"""	"How to get timestamp in string format in Java? ""yyyy.MM.dd.HH.mm.ss"" -CODE- . This is what I have, but Timestamp() requires an parameters..."	no
3	https://stackoverflow.com/questions/11943948	I want to execute my program without using an IDE.	"What causes ""Unable to access jar file"" error?"	"I want to execute my program without using an IDE. I've created a jar file and an exectuable jar file. When I double click the exe jar file, nothing happens, and when I try to use the command in cmd it gives me this: -CODE- . I use the command: java -jar Calculator.jar. How I created the jar: [1]Right click on project folder (Calculator) . [2]Select. [3]Click on Java Folder and select ""Exectuable Jar File"", then select next. [4]Launch Configuration: Main - Calculator. [5]Create Export Destination. [6]Hit ""Finish"" and profit! Well, not really.."	no
4	https://stackoverflow.com/questions/9043981	I have this date object: -CODE- .	How to add minutes to my Date	"I have this date object: -CODE- . value of d1 is Fri Jan 07 17:40:00 PKT 2011. Now I am trying to add 10 minutes to the date above. -CODE- . Value of newTime changes to 2011-50-07 17:50 but it should be 07-01-2011 17:50. It adds minutes correctly but it also changes month, don't know why!"	no
5	https://stackoverflow.com/questions/9043981	"but it also changes month,"	How to add minutes to my Date	"I have this date object: -CODE- . value of d1 is Fri Jan 07 17:40:00 PKT 2011. Now I am trying to add 10 minutes to the date above. -CODE- . Value of newTime changes to 2011-50-07 17:50 but it should be 07-01-2011 17:50. It adds minutes correctly but it also changes month, don't know why!"	no
6	https://stackoverflow.com/questions/589870	Should I use Java date and time classes or go with a 3rd party library like Joda Time?	Should I use Java date and time classes or go with a 3rd party library like Joda Time?	"I'm creating a web based system which will be used in countries from all over the world. One type of data which must be stored is dates and times. What are the pros and cons of using the Java date and time classes compared to 3rd party libraries such as Joda time? I guess these third party libraries exist for a good reason, but I've never really compared them myself."	no
7	https://stackoverflow.com/questions/6389827	I abhore doing things like: -CODE- .	String variable interpolation Java	"String building in Java confounds me. I abhore doing things like: -CODE- . Or, using StringBuilder, something like this: -CODE- . SURELY I'm missing something. There has GOT to be a better way. Something like: Instead of: -CODE- . do: -CODE- . or: -CODE- ."	no
8	https://stackoverflow.com/questions/6389827	Something like: Instead of: -CODE- . do: -CODE- .	String variable interpolation Java	"String building in Java confounds me. I abhore doing things like: -CODE- . Or, using StringBuilder, something like this: -CODE- . SURELY I'm missing something. There has GOT to be a better way. Something like: Instead of: -CODE- . do: -CODE- . or: -CODE- ."	no
9	https://stackoverflow.com/questions/9306202	For example: -CODE- .	regex for matching something if it is not preceded by something else	"So with regex in java, I want to write a regex that will match if and only if the pattern is not preceded by certain characters. For example: -CODE- . I want to match if bar is not preceded by foo. So output would be: -CODE- . I know this is probably a very simple question. I am trying to learn regex, but in the meantime I need something to work now."	no
10	https://stackoverflow.com/questions/9306202	I want to match if bar is not preceded by foo.	regex for matching something if it is not preceded by something else	"So with regex in java, I want to write a regex that will match if and only if the pattern is not preceded by certain characters. For example: -CODE- . I want to match if bar is not preceded by foo. So output would be: -CODE- . I know this is probably a very simple question. I am trying to learn regex, but in the meantime I need something to work now."	no
11	https://stackoverflow.com/questions/9306202	So output would be: -CODE- .	regex for matching something if it is not preceded by something else	"So with regex in java, I want to write a regex that will match if and only if the pattern is not preceded by certain characters. For example: -CODE- . I want to match if bar is not preceded by foo. So output would be: -CODE- . I know this is probably a very simple question. I am trying to learn regex, but in the meantime I need something to work now."	no
12	https://stackoverflow.com/questions/8405087	What is this date format?	What is this date format? 2011-08-12T20:17:46.384Z	"I have the following date: 2011-08-12T20:17:46.384Z. What format is this? I'm trying to parse it with Java 1.4 via DateFormat.getDateInstance().parse(dateStr) and I'm getting: -CODE- . I think I should be using SimpleDateFormat for parsing, but I have to know the format string first. All I have for that so far is yyyy-MM-dd, because I don't know what the T means in this string--something time zone-related? This date string is coming from the lcmis:downloadedOn tag shown on Files CMIS download history media type."	no
13	https://stackoverflow.com/questions/8405087	I'm trying to parse it with Java 1.4 via DateFormat.getDateInstance().parse(dateStr)	What is this date format? 2011-08-12T20:17:46.384Z	"I have the following date: 2011-08-12T20:17:46.384Z. What format is this? I'm trying to parse it with Java 1.4 via DateFormat.getDateInstance().parse(dateStr) and I'm getting: -CODE- . I think I should be using SimpleDateFormat for parsing, but I have to know the format string first. All I have for that so far is yyyy-MM-dd, because I don't know what the T means in this string--something time zone-related? This date string is coming from the lcmis:downloadedOn tag shown on Files CMIS download history media type."	no
14	https://stackoverflow.com/questions/508019	When it's displayed it will be formatted as 9:30am PST.	How to store date/time and timestamps in UTC time zone with JPA and Hibernate	"How can I configure JPA/Hibernate to store a date/time in the database as UTC (GMT) time zone? Consider this annotated JPA entity: -CODE- . If the date is 2008-Feb-03 9:30am Pacific Standard Time (PST), then I want the UTC time of 2008-Feb-03 5:30pm stored in the database. Likewise, when the date is retrieved from the database, I want it interpreted as UTC. So in this case 530pm is 530pm UTC. When it's displayed it will be formatted as 9:30am PST."	no
15	https://stackoverflow.com/questions/123	Java lib or app to convert CSV to XML file?	Java lib or app to convert CSV to XML file?	Is there an existing application or library in Java which will allow me to convert a CSV data file to XML file? The XML tags would be provided through possibly the first row containing column headings.	no
16	https://stackoverflow.com/questions/4964484	Split on an empty string returns an array of size 1 : -CODE- .	"Why does ""split"" on an empty string return a non-empty array?"	Split on an empty string returns an array of size 1 : -CODE- . Consider that this returns empty array: -CODE- . Please explain :)	no
17	https://stackoverflow.com/questions/3047564	"Java synchronized method lock on object, or method?"	"Java synchronized method lock on object, or method?"	"If I have 2 synchronized methods in the same class, but each accessing different variables, can 2 threads access those 2 methods at the same time? Does the lock occur on the object, or does it get as specific as the variables inside the synchronized method? Example: -CODE- . Can 2 threads access the same instance of class X performing x.addA() and x.addB() at the same time?"	no
18	https://stackoverflow.com/questions/3047564	"Does the lock occur on the object, or does it get as specific as the variables inside the synchronized method?"	"Java synchronized method lock on object, or method?"	"If I have 2 synchronized methods in the same class, but each accessing different variables, can 2 threads access those 2 methods at the same time? Does the lock occur on the object, or does it get as specific as the variables inside the synchronized method? Example: -CODE- . Can 2 threads access the same instance of class X performing x.addA() and x.addB() at the same time?"	no
19	https://stackoverflow.com/questions/5193883	gives an error.	How do you specify a byte literal in Java?	If I have a method : -CODE- . how can I call it with a numeric argument without casting? -CODE- . gives an error.	no
20	https://stackoverflow.com/questions/14319787	What I'm trying to do is pass method displayInt to method myForEach using a method reference.	How to specify function types for void (not Void) methods in Java8?	"I'm playing around with Java 8 to find out how functions as first class citizens. I have the following snippet: -CODE- . What I'm trying to do is pass method displayInt to method myForEach using a method reference. To compiler produces the following error: -CODE- . The compiler complains that void cannot be converted to Void. I don't know how to specify the type of the function interface in the signature of myForEach such that the code compiles. I know I could simply change the return type of displayInt to Void and then return null. However, there may be situations where it's not possible to alter the method I want to pass somewhere else. Is there an easy way to reuse displayInt as it is?"	no
21	https://stackoverflow.com/questions/29262002	"The weird thing is that the line marked ""OK"" compiles fine, but the line marked ""Error"" fails."	Why does this Java 8 lambda fail to compile?	"The following Java code fails to compile: -CODE- . The compiler reports: -CODE- . The weird thing is that the line marked ""OK"" compiles fine, but the line marked ""Error"" fails. They seem essentially identical."	no
22	https://stackoverflow.com/questions/6029495	I want to generate random number in a specific range.	How can I generate random number in specific range in Android?	" -CODE- . I want to generate random number in a specific range. (Ex. Range Between 65 to 80) I try as per below code, but it is not very use full. It also returns the value greater then max. value(greater then 80). -CODE- . How can I generate random number in between range?"	yes
23	https://stackoverflow.com/questions/6029495	"I try as per below code, but it is not very use full."	How can I generate random number in specific range in Android?	" -CODE- . I want to generate random number in a specific range. (Ex. Range Between 65 to 80) I try as per below code, but it is not very use full. It also returns the value greater then max. value(greater then 80). -CODE- . How can I generate random number in between range?"	no
24	https://stackoverflow.com/questions/6029495	It also returns the value greater then	How can I generate random number in specific range in Android?	" -CODE- . I want to generate random number in a specific range. (Ex. Range Between 65 to 80) I try as per below code, but it is not very use full. It also returns the value greater then max. value(greater then 80). -CODE- . How can I generate random number in between range?"	no
25	https://stackoverflow.com/questions/2638016	"I am trying to ""import existing project into workspace""."	"Why ""no projects found to import""?"	"I am trying to ""import existing project into workspace"". As the ""root directory"" I select the directory where all my .java (and .class) files are located. Eclipse writes me that ""no projects are found to import"". Why?"	no
26	https://stackoverflow.com/questions/6979796	1]I believe the code below result in the same output both when using yield() and when not using it.	"What are the main uses of yield(), and how does it differ from join() and interrupt()?"	"I am a little bit confused about the use of yield() method in Java, specifically in the example code below. I've also read that yield() is 'used to prevent execution of a thread'. My questions are: [1]I believe the code below result in the same output both when using yield() and when not using it. Is this correct?. [2]What are, in fact, the main uses of yield()?. [3]In what ways is yield() different from the join() and interrupt() methods?. The code example: -CODE- . I obtain the same output using the code above both with and without using yield(): -CODE- ."	no
27	https://stackoverflow.com/questions/6979796	The code example: -CODE- .	"What are the main uses of yield(), and how does it differ from join() and interrupt()?"	"I am a little bit confused about the use of yield() method in Java, specifically in the example code below. I've also read that yield() is 'used to prevent execution of a thread'. My questions are: [1]I believe the code below result in the same output both when using yield() and when not using it. Is this correct?. [2]What are, in fact, the main uses of yield()?. [3]In what ways is yield() different from the join() and interrupt() methods?. The code example: -CODE- . I obtain the same output using the code above both with and without using yield(): -CODE- ."	no
28	https://stackoverflow.com/questions/27787487	I get the same error.	Java verify void method calls n times with Mockito	"I'm trying to verify that a (void) method is being called inside of a DAO - I'm using a commit point that sends a list of results up to that point, resets the list and continues. Say I have 4 things in the list and I have a commit point of 1, I would expect the ""send"" method to be called 4 times. I can verify that the method gets called once by writing. Mockito.verify(mock).send() it passes.. but I want to verify the number of times it was called. I would think that. Mockito.verify(mock.send(), times(4)) would be sufficient, but it says the parameters are not correct for verify. Incidentally, if I change Mockito.verify(mock).send() to Mockito.verify(mock.send()) or Mockito.verify((mock).send()) I get the same error. Thoughts on this?"	no
29	https://stackoverflow.com/questions/2081005	What is .jspf file extension?	What is .jspf file extension? How to compile it?	"What are .jspf files in JSP? As I know the compiler will look for .jsp files to compile, then how are the .jspf files compiled?"	no
30	https://stackoverflow.com/questions/8896758	What is the use of setting an initial size if you can't access the space you allocated?	Initial size for the ArrayList	"You can set the initial size for an ArrayList by doing: -CODE- . However, you can't do: -CODE- . because it causes an out of bounds exception. What is the use of setting an initial size if you can't access the space you allocated? The add function is defined as add(int index, Object element) so I am not adding to index 10."	no
31	https://stackoverflow.com/questions/2572566	How does @Version annotation work in JPA?	Java - JPA - @Version annotation	How does @Version annotation work in JPA? I found various answers whose extract is as follows: -CODE- . But I am still not sure how it works. Also as from the following lines: -CODE- . Does it mean that we should declare our version field as final?	no
32	https://stackoverflow.com/questions/13386107	Is there any inbuilt function to remove an individual character of a String in java?	How to remove single character from a String	"For accessing individual characters of a String in Java, we have String.charAt(2). Is there any inbuilt function to remove an individual character of a String in java? Something like this: -CODE- ."	no
33	https://stackoverflow.com/questions/4964640	"I'm trying to read from a text/plain file over the internet, line-by-line."	Reading InputStream as UTF-8	"I'm trying to read from a text/plain file over the internet, line-by-line. The code I have right now is: -CODE- . The file, test.txt, contains ¡Hélló!, which I am using in order to test the encoding. When I review the OutputStream (out), I see it as > ¬°H√©ll√≥!. I don't believe this is a problem with the OutputStream since I can do out.println(""é""); without problems. Any ideas for reading form the InputStream as UTF-8? Thanks!"	yes
34	https://stackoverflow.com/questions/4964640	The code I have right now is: -CODE- .	Reading InputStream as UTF-8	"I'm trying to read from a text/plain file over the internet, line-by-line. The code I have right now is: -CODE- . The file, test.txt, contains ¡Hélló!, which I am using in order to test the encoding. When I review the OutputStream (out), I see it as > ¬°H√©ll√≥!. I don't believe this is a problem with the OutputStream since I can do out.println(""é""); without problems. Any ideas for reading form the InputStream as UTF-8? Thanks!"	no
35	https://stackoverflow.com/questions/4964640	"The file, test.txt, contains ¡Hélló!, which I am using in order to test the encoding."	Reading InputStream as UTF-8	"I'm trying to read from a text/plain file over the internet, line-by-line. The code I have right now is: -CODE- . The file, test.txt, contains ¡Hélló!, which I am using in order to test the encoding. When I review the OutputStream (out), I see it as > ¬°H√©ll√≥!. I don't believe this is a problem with the OutputStream since I can do out.println(""é""); without problems. Any ideas for reading form the InputStream as UTF-8? Thanks!"	no
36	https://stackoverflow.com/questions/868651	I'm trying to display tooltips in Java which may or may not be paragraph-length.	Multi-line tooltips in Java?	I'm trying to display tooltips in Java which may or may not be paragraph-length. How can I word-wrap long tooltips?	no
37	https://stackoverflow.com/questions/2883887	"In JPA 2, using a CriteriaQuery, how to count results"	"In JPA 2, using a CriteriaQuery, how to count results"	"I am rather new to JPA 2 and it's CriteriaBuilder / CriteriaQuery API: CriteriaQuery javadoc. CriteriaQuery in the Java EE 6 tutorial. I would like to count the results of a CriteriaQuery without actually retrieving them. Is that possible, I did not find any such method, the only way would be to do this: -CODE- . And that can't be the proper way to do it... Is there a solution?"	no
38	https://stackoverflow.com/questions/344380	"In java.util.Calendar, January is defined as month 0, not month 1."	Why is January month 0 in Java Calendar?	"In java.util.Calendar, January is defined as month 0, not month 1. Is there any specific reason to that ? I have seen many people getting confused about that..."	no
39	https://stackoverflow.com/questions/2163045	How to remove line breaks from a file in Java?	How to remove line breaks from a file in Java?	How can I replace all line breaks from a string in Java in such a way that will work on Windows and Linux (ie no OS specific problems of carriage return/line feed/new line etc.)? I've tried (note readFileAsString is a function that reads a text file into a String): -CODE- . but this doesn't seem to work. How can this be done?	yes
40	https://stackoverflow.com/questions/2163045	How can I replace all line breaks from a string in Java in such a way that will work on Windows and Linux (ie no OS specific problems of carriage return/line feed/new line etc.)?	How to remove line breaks from a file in Java?	How can I replace all line breaks from a string in Java in such a way that will work on Windows and Linux (ie no OS specific problems of carriage return/line feed/new line etc.)? I've tried (note readFileAsString is a function that reads a text file into a String): -CODE- . but this doesn't seem to work. How can this be done?	yes
41	https://stackoverflow.com/questions/2163045	but this doesn't seem to work.	How to remove line breaks from a file in Java?	How can I replace all line breaks from a string in Java in such a way that will work on Windows and Linux (ie no OS specific problems of carriage return/line feed/new line etc.)? I've tried (note readFileAsString is a function that reads a text file into a String): -CODE- . but this doesn't seem to work. How can this be done?	no
42	https://stackoverflow.com/questions/3653996	gives : -CODE- .	How to parse a JSON string into JsonNode in Jackson?	"It should be so simple, but I just cannot find it after being trying for an hour #embarrasing. I need to get a JSON string, for example, {""k1"":v1,""k2"":v2}, parsed as a JsonNode. -CODE- . gives : -CODE- ."	no
43	https://stackoverflow.com/questions/2490737	I generated a web-service client using JBoss utils (JAX-WS compatible) using Eclipse 'web service client from a wsdl'.	How to change webservice url endpoint?	"I generated a web-service client using JBoss utils (JAX-WS compatible) using Eclipse 'web service client from a wsdl'. So, the only thing I provided was a url to a web-service WSDL. Now, the web service provider tells me to change the ""url of client endpoint application access"" of the web-service. What is it and how to change it?"	no
44	https://stackoverflow.com/questions/13386107	How to remove single character from a String	How to remove single character from a String	"For accessing individual characters of a String in Java, we have String.charAt(2). Is there any inbuilt function to remove an individual character of a String in java? Something like this: -CODE- ."	no
45	https://stackoverflow.com/questions/2654839	but it's not working.	Rounding a double to turn it into an int (java)	Right now I'm trying this: -CODE- . where n is a double but it's not working. What am I doing wrong?	no
46	https://stackoverflow.com/questions/1835430	I'm trying to read CSV files using Java.	Byte order mark screws up file reading in Java	"I'm trying to read CSV files using Java. Some of the files may have a byte order mark in the beginning, but not all. When present, the byte order gets read along with the rest of the first line, thus causing problems with string compares. Is there an easy way to skip the byte order mark when it is present? Thanks!"	no
47	https://stackoverflow.com/questions/4030928	Extract digits from a string in Java	Extract digits from a string in Java	"I have a Java String object. I need to extract only digits from it. I'll give an example: ""123-456-789"" I want ""123456789"" Is there a library function that extracts only digits? Thanks for the answers. Before I try these I need to know if I have to install any additional llibraries?"	no
48	https://stackoverflow.com/questions/28459498	It is however great example of the expressive power of lambda expression combined with stream operation.	Why are Java Streams once-off?	"Unlike C#'s IEnumerable, where an execution pipeline can be executed as many times as we want, in Java a stream can be 'iterated' only once. Any call to a terminal operation closes the stream, rendering it unusable. This 'feature' takes away a lot of power. I imagine the reason for this is not technical. What were the design considerations behind this strange restriction? Edit: in order to demonstrate what I am talking about, consider the following implementation of Quick-Sort in C#: -CODE- . Now to be sure, I am not advocating that this is a good implementation of quick sort! It is however great example of the expressive power of lambda expression combined with stream operation. And it can't be done in Java! I can't even ask a stream whether it is empty without rendering it unusable."	no
49	https://stackoverflow.com/questions/213506	What should I be using instead?	"java.net.URLEncoder.encode(String) is deprecated, what should I use instead?"	I get the following warning when using java.net.URLEncoder.encode: -CODE- . What should I be using instead?	no
50	https://stackoverflow.com/questions/3965446	how to read System environment variable in Spring applicationContext	how to read System environment variable in Spring applicationContext	How to read the system environment variable in the application context? I want something like : -CODE- . or: -CODE- . depending on the environement. Can I have something like this in my application Context? -CODE- . where the actual val is set based on the SYSTEM ENVIRONMENT VARIABLE. I'm using Spring 3.0.	no
51	https://stackoverflow.com/questions/3965446	I want something like : -CODE- .	how to read System environment variable in Spring applicationContext	How to read the system environment variable in the application context? I want something like : -CODE- . or: -CODE- . depending on the environement. Can I have something like this in my application Context? -CODE- . where the actual val is set based on the SYSTEM ENVIRONMENT VARIABLE. I'm using Spring 3.0.	no
