	url	sentence	title	body	arbitration
572	https://stackoverflow.com/questions/3643939	Other output streams don't work?	Java Process with Input/Output Stream	"I have the following code example below. Whereby you can enter a command to the bash shell i.e. echo test and have the result echo'd back. However, after the first read. Other output streams don't work? Why is this or am I doing something wrong? My end goal is to created a Threaded scheduled task that executes a command periodically to /bash so the OutputStream and InputStream would have to work in tandem and not stop working. I have also been experiencing the error java.io.IOException: Broken pipe any ideas? Thanks. -CODE- ."	no
573	https://stackoverflow.com/questions/35183146	I am interested in converting the point in time represented by the long to a LocalDate in my current local timezone.	How can I create a Java 8 LocalDate from a long Epoch time in Milliseconds?	"I have an external API return me dates as longs, represented as milliseconds since Epoch. With the old style Java API, I would simply construct a Date from it with: -CODE- . What is the equivalent in Java 8's LocalDate/LocalDateTime classes? I am interested in converting the point in time represented by the long to a LocalDate in my current local timezone."	no
574	https://stackoverflow.com/questions/31398444	"There is no relation between interface C and class B, but it gives false whereas in case of obj instanceof A it gives compiler error?"	The 'instanceof' operator behaves differently for interfaces and classes	"I would like to know regarding following behavior of instanceof operator in Java. -CODE- . Why is it so? There is no relation between interface C and class B, but it gives false whereas in case of obj instanceof A it gives compiler error?"	no
575	https://stackoverflow.com/questions/5364278	I am new to Java and for the time created an array of objects in Java.	Creating an array of objects in Java	I am new to Java and for the time created an array of objects in Java. I have a class A for example - -CODE- . But this is only creating pointers (references) to A and not 4 objects. Is this correct? I see that when I try to access functions/variables in the objects created I get a null pointer exception. To be able to manipulate/access the objects I had to do this -- -CODE- . Is this correct or am I doing something wrong? If this is correct its really odd. EDIT: I find this odd because in C++ you just say new A[4] and it creates the four objects.	no
576	https://stackoverflow.com/questions/16030858	And the output of this code is this: -CODE- .	Why does changing the returned variable in a finally block not change the return value?	"I have a simple Java class as shown below: -CODE- . And the output of this code is this: -CODE- . Why is s not overridden in the finally block, yet control printed output?"	no
577	https://stackoverflow.com/questions/580160	I am using TreeBidiMap from the Apache Collections library.	How to convert a Collection to List?	"I am using TreeBidiMap from the Apache Collections library. I want to sort this on the values which are doubles. My method is to retrieve a Collection of the values using: -CODE- . Which naturally works fine. Main Question: I now want to know how I can convert/cast (not sure which is correct) coll into a List so it can be sorted? I then intend to iterate over the sorted List object, which should be in order and get the appropriate keys from the TreeBidiMap (themap) using themap.getKey(iterator.next()) where the iterator will be over the list of doubles."	no
578	https://stackoverflow.com/questions/580160	Main Question: I now want to know how I can convert	How to convert a Collection to List?	"I am using TreeBidiMap from the Apache Collections library. I want to sort this on the values which are doubles. My method is to retrieve a Collection of the values using: -CODE- . Which naturally works fine. Main Question: I now want to know how I can convert/cast (not sure which is correct) coll into a List so it can be sorted? I then intend to iterate over the sorted List object, which should be in order and get the appropriate keys from the TreeBidiMap (themap) using themap.getKey(iterator.next()) where the iterator will be over the list of doubles."	no
579	https://stackoverflow.com/questions/18176594	I am reading about generic methods from OracleDocGenericMethod.	When to use generic methods and when to use wild-card?	"I am reading about generic methods from OracleDocGenericMethod. I am pretty confused about the comparison when it says when to use wild-card and when to use generic methods. Quoting from the document. -CODE- . Don't we think wild card like (Collection<? extends E> c); is also supporting kind of polymorphism? Then why generic method usage is considered not good in this? Continuing ahead, it states, -CODE- . What does this mean? They have presented the example: -CODE- . The document discourages the second declaration and promotes usage of first syntax? What's the difference between the first and second declaration? Both seems to be doing the same thing? Can someone put light on this area."	no
580	https://stackoverflow.com/questions/18176594	They have presented the example: -CODE- .	When to use generic methods and when to use wild-card?	"I am reading about generic methods from OracleDocGenericMethod. I am pretty confused about the comparison when it says when to use wild-card and when to use generic methods. Quoting from the document. -CODE- . Don't we think wild card like (Collection<? extends E> c); is also supporting kind of polymorphism? Then why generic method usage is considered not good in this? Continuing ahead, it states, -CODE- . What does this mean? They have presented the example: -CODE- . The document discourages the second declaration and promotes usage of first syntax? What's the difference between the first and second declaration? Both seems to be doing the same thing? Can someone put light on this area."	no
581	https://stackoverflow.com/questions/2873949	Is there any way to inspect the entire string?	Viewing complete strings while debugging in Eclipse	"While debugging Java code, Strings in the views ""Variables"" and ""Expressions"" show up only till a certain length, after which Eclipse shows ""..."" Is there any way to inspect the entire string? (This eases the pain of adding logging statements for debugging everywhere)"	no
582	https://stackoverflow.com/questions/31316581	"First, I am quite confused why the sneakyThrow call is OK to the compiler."	A peculiar feature of exception type inference in Java 8	"While writing code for another answer on this site I came across this peculiarity: -CODE- . First, I am quite confused why the sneakyThrow call is OK to the compiler. What possible type did it infer for T when there is no mention anywhere of an unchecked exception type? Second, accepting that this works, why then does the compiler complain on the nonSneakyThrow call? They seem very much alike."	no
583	https://stackoverflow.com/questions/5757552	The way I'm doing it: -CODE- .	Deleting an object in java?	"I want to delete an object I created, (a oval which follows you), but how would I do this? -CODE- . didn't work. EDIT: Okay, I'll give some more context. I'm making a small game with a oval you can control, and a oval which follows you. Now I've got files named: DrawPanel.class, this class draws everything on the screen, and handles collisions, sounds, etc. I got an enemy.class, which is the oval following the player. I got an entity.class, which is the player you can control. And if the player intersects with the follower, I want my player object to get deleted. The way I'm doing it: -CODE- ."	no
584	https://stackoverflow.com/questions/32807587	then add required permissions but	com.android.build.transform.api.TransformException	"i am trying to integrate google sign in , in my app,i added these libraries: -CODE- . also add this to project build gradle: -CODE- . also add plugin to app build gradle: -CODE- . then add required permissions but when i try to run my app , received this error: -CODE- ."	no
585	https://stackoverflow.com/questions/26745541	We will be getting rid of those in favor of Gradle eventually	Best way to add Gradle support to IntelliJ Project	"I have looked around quite a bit and haven't found the best solution to convert an existing IntelliJ project to Gradle. I work in a team environment and we currently share the .ipr file as we have a few build configurations that we track. We will be getting rid of those in favor of Gradle eventually but I can't screw things up too much until the Gradle conversion is done. Also, our Java source files are located in the root of the src directory instead of src/main/java as is standard. Is there a way I can add Gradle to my project that won't make me delete and recreate my IntelliJ project and won't screw everyone else up when they do a Git pull?"	no
586	https://stackoverflow.com/questions/10230929	How can I convert String[] to ArrayList<String>	How can I convert String[] to ArrayList<String>	 -CODE- . I need to convert a String[] to an ArrayList<String> and I don't know how: -CODE- . Basically I would like to transform filesOrig into an ArrayList.	no
587	https://stackoverflow.com/questions/26745541	but I can't screw things up too much until the Gradle conversion is done.	Best way to add Gradle support to IntelliJ Project	"I have looked around quite a bit and haven't found the best solution to convert an existing IntelliJ project to Gradle. I work in a team environment and we currently share the .ipr file as we have a few build configurations that we track. We will be getting rid of those in favor of Gradle eventually but I can't screw things up too much until the Gradle conversion is done. Also, our Java source files are located in the root of the src directory instead of src/main/java as is standard. Is there a way I can add Gradle to my project that won't make me delete and recreate my IntelliJ project and won't screw everyone else up when they do a Git pull?"	no
588	https://stackoverflow.com/questions/678630	"Android has java.net.CookieHandler, but it does not seem to have java.net.CookieManager."	How do I make an http request using cookies on Android?	"I'd like to make an http request to a remote server while properly handling cookies (eg. storing cookies sent by the server, and sending those cookies when I make subsequent requests). It'd be nice to preserve any and all cookies, but really the only one I care about is the session cookie. With java.net, it appears that the preferred way to do this is using java.net.CookieHandler (abstract base class) and java.net.CookieManager (concrete implementation). Android has java.net.CookieHandler, but it does not seem to have java.net.CookieManager. I could code it all by hand by inspecting http headers, but it seems like there must be an easier way. What is the proper way to make http requests on Android while preserving cookies?"	no
589	https://stackoverflow.com/questions/219881	Java array reflection: isArray vs. instanceof	Java array reflection: isArray vs. instanceof	Is there a preference or behavior difference between using: -CODE- . and: -CODE- . ?	no
590	https://stackoverflow.com/questions/4266756	I am trying to convert a signed byte in unsigned.	Can we make unsigned byte in Java	"I am trying to convert a signed byte in unsigned. The problem is the data I am receiving is unsigned and Java does not support unsigned byte, so when it reads the data it treats it as signed. I tried it to convert it by the following solution I got from Stack Overflow. -CODE- . But when again it's converted in byte, I get the same signed data. I am trying to use this data as a parameter to a function of Java that accepts only a byte as parameter, so I can't use any other data type. How can I fix this problem?"	yes
591	https://stackoverflow.com/questions/4266756	I tried it to convert it by the following solution I got from Stack Overflow. -CODE- .	Can we make unsigned byte in Java	"I am trying to convert a signed byte in unsigned. The problem is the data I am receiving is unsigned and Java does not support unsigned byte, so when it reads the data it treats it as signed. I tried it to convert it by the following solution I got from Stack Overflow. -CODE- . But when again it's converted in byte, I get the same signed data. I am trying to use this data as a parameter to a function of Java that accepts only a byte as parameter, so I can't use any other data type. How can I fix this problem?"	no
592	https://stackoverflow.com/questions/924451	but it doesn't (where map is already in the request's attributes)	EL access a map value by Integer key	"I have a Map keyed by Integer. Using EL, how can I access a value by its key? -CODE- . I thought this would work but it doesn't (where map is already in the request's attributes): -CODE- . Follow up: I tracked down the problem. Apparently ${name[1]} does a map lookup with the number as a Long. I figured this out when I changed HashMap to TreeMap and received the error: -CODE- . If I change my map to be: -CODE- . then ${name[1]} returns ""One"". What's with that? Why does <c:out> treat a number as a long. Seems counterintuitive to me (as int is more commonly used than long). So my new question is, is there a EL notation to access a map by an Integer value?"	no
593	https://stackoverflow.com/questions/924451	"then ${name[1]} returns ""One""."	EL access a map value by Integer key	"I have a Map keyed by Integer. Using EL, how can I access a value by its key? -CODE- . I thought this would work but it doesn't (where map is already in the request's attributes): -CODE- . Follow up: I tracked down the problem. Apparently ${name[1]} does a map lookup with the number as a Long. I figured this out when I changed HashMap to TreeMap and received the error: -CODE- . If I change my map to be: -CODE- . then ${name[1]} returns ""One"". What's with that? Why does <c:out> treat a number as a long. Seems counterintuitive to me (as int is more commonly used than long). So my new question is, is there a EL notation to access a map by an Integer value?"	no
594	https://stackoverflow.com/questions/11229986	Get string character by index - Java	Get string character by index - Java	"I know how to work out the index of a certain character or number in a string, but is there any predefined method I can use to give me the character at the nth position? So in the string ""foo"", if I asked for the character with index 0 it would return ""f"". Note - in the above question, by ""character"" I don't mean the char data type, but a letter or number in a string. The important thing here is that I don't receive a char when the method is invoked, but a string (of length 1). And I know about the substring() method, but I was wondering if there was a neater way."	no
595	https://stackoverflow.com/questions/11229986	"So in the string ""foo"", if I asked for the character with index 0 it would return ""f""."	Get string character by index - Java	"I know how to work out the index of a certain character or number in a string, but is there any predefined method I can use to give me the character at the nth position? So in the string ""foo"", if I asked for the character with index 0 it would return ""f"". Note - in the above question, by ""character"" I don't mean the char data type, but a letter or number in a string. The important thing here is that I don't receive a char when the method is invoked, but a string (of length 1). And I know about the substring() method, but I was wondering if there was a neater way."	no
596	https://stackoverflow.com/questions/24501042	Here is my full layout code: -CODE- .	Android app in Eclipse: Edit text not showing on Graphical layout	"I am trying to add a text field onto my Android app in Eclipse, but then I drag the Plain text option on to the graphical layout, a message at the bottom comes up. It reads Exception raised during rendering: java.lang.System.arraycopy([CI[CII)V Exception details are logged in Window > Show View > Error Log Even when I go to Window > Show View there is no error log option. The whole designer is useless now, because I can not use it anymore until I delete the EditText directly from the xml. What is causing this error, and how do I fix it? I am running the latest version (as of today, 6-30-14), and Windows 8 Pro x64. Here is my full layout code: -CODE- ."	no
597	https://stackoverflow.com/questions/2743130	I get following hibernate error.	Hibernate - Batch update returned unexpected row count from update: 0 actual row count: 0 expected: 1	I get following hibernate error. I am able to identify the function which causes the issue. Unfortunately there are several DB calls in the function. I am unable to find the line which causes the issue since hibernate flush the session at the end of the transaction. The below mentioned hibernate error looks like a general error. It doesn't even mentioned which Bean causes the issue. Anyone familiar with this hibernate error? -CODE- .	no
598	https://stackoverflow.com/questions/1743715	Behaviour of final static method	Behaviour of final static method	"I have been playing around with modifiers with static method and came across a weird behaviour. As we know, static methods cannot be overridden, as they are associated with class rather than instance. So if I have the below snippet, it compiles fine: -CODE- . But if I include final modifier to static method in class A, then compilation fails ts() in B cannot override ts() in A; overridden method is static final. Why is this happening when static method cannot be overridden at all?"	no
599	https://stackoverflow.com/questions/24173463	"I would have expected the first time round we would have i = 1 + 1, followed by i = 2 + 2, followed by i = 4 + 4 etc."	Why does i = i + i give me 0?	"I have a simple program: -CODE- . When I run this program, all I see is 0 for i in my output. I would have expected the first time round we would have i = 1 + 1, followed by i = 2 + 2, followed by i = 4 + 4 etc. Is this due to the fact that as soon as we try to re-declare i on the left hand-side, its value gets reset to 0? If anyone can point me into the finer details of this that would be great. Change the int to long and it seems to be printing numbers as expected. I'm surprised at how fast it hits the max 32-bit value!"	no
600	https://stackoverflow.com/questions/1448858	How can I color Java output?	How to color System.out.println output?	How can I color Java output? For example in C and other languages I can use ANSI-escape like \033[0m to do this. But in Java it doesn't work. -CODE- .	yes
601	https://stackoverflow.com/questions/7199666	Example: I compiled this simple program: -CODE- .	Difference between & and && in Java?	" -CODE- . I was just wondering what the difference between & and && is? A few days I wrote a condition for an if statement the looked something like: -CODE- . However, I changed the && to just & and it showed no errors. What's the difference? Example: I compiled this simple program: -CODE- . It printed ""OK"" and ""Yup"". So does it matter which one I use if they both work?"	no
602	https://stackoverflow.com/questions/7199666	So does it matter which one I use if they both work?	Difference between & and && in Java?	" -CODE- . I was just wondering what the difference between & and && is? A few days I wrote a condition for an if statement the looked something like: -CODE- . However, I changed the && to just & and it showed no errors. What's the difference? Example: I compiled this simple program: -CODE- . It printed ""OK"" and ""Yup"". So does it matter which one I use if they both work?"	no
603	https://stackoverflow.com/questions/4496359	How to parse date string to Date?	How to parse date string to Date?	How do I parse the date string below into a Date object? -CODE- . Throws exception... -CODE- .	no
604	https://stackoverflow.com/questions/5102571	EDIT: I do know I can add to pom.xml this code: -CODE- .	How to install Maven artifact with sources from command line?	How to install Maven artifact with sources? so later I don't need to open a project in eclipse to see some code. EDIT: I do know I can add to pom.xml this code: -CODE- . but I would like to do it from command line(to make it more universal).	no
605	https://stackoverflow.com/questions/1694751	Is there any EASY way to sort an array in descending order like how they have a sort in ascending order in the Arrays class?	Java Array Sort descending?	Is there any EASY way to sort an array in descending order like how they have a sort in ascending order in the Arrays class? Or do I have to stop being lazy and do this myself :[	no
606	https://stackoverflow.com/questions/629804	So which Java Collections library is best now?	What is the most efficient Java Collections library?	"What is the most efficient Java Collections library? A few years ago, I did a lot of Java and had the impression back then that trove is the best (most efficient) Java Collections implementation. But when I read the answers to the question ""Most useful free Java libraries?"" I noticed that trove is hardly mentioned. So which Java Collections library is best now? UPDATE: To clarify, I mostly want to know what library to use when I have to store millions of entries in a hash table etc. (need a small runtime and memory footprint)."	no
607	https://stackoverflow.com/questions/842817	How does Java convert int into byte?	How does Java convert int into byte?	" -CODE- . The output is -124. Why is that? I know this is a very basic question, but I'm still not able to map it, or understand how this happens?"	yes
608	https://stackoverflow.com/questions/7199911	how to File.listFiles in alphabetical order?	how to File.listFiles in alphabetical order?	"I've got code as below: -CODE- . The FileFilter is working nicely, but listFiles() seems to be listing the files in reverse alphabetical order. Is there some quick way of telling listFile() to list the files in alphabetical order?"	yes
609	https://stackoverflow.com/questions/23944370	I am wondering if there is a way to get current milliseconds since 1-1-1970 (epoch)	How to get milliseconds from LocalDateTime in Java 8	"I am wondering if there is a way to get current milliseconds since 1-1-1970 (epoch) using the new LocalDate, LocalTime or LocalDateTime classes of Java 8. The known way is below: -CODE- . or: -CODE- ."	no
610	https://stackoverflow.com/questions/1678520	"I'm trying to use javac with the windows command prompt, but it's not working."	javac not working in windows command prompt	"I'm trying to use javac with the windows command prompt, but it's not working. After adding the directory ""C:\Program Files\Java\jdk1.6.0_16\bin\"" to the end of the PATH environment variable, the java command works fine, but using javac gives me the following error: -CODE- ."	no
611	https://stackoverflow.com/questions/3038392	"If so, what is it?"	Do Java arrays have a maximum size?	"Is there a limit to the number of elements a Java array can contain? If so, what is it?"	no
612	https://stackoverflow.com/questions/24386771	write code: -CODE- .	javax.validation.ValidationException: HV000183: Unable to load 'javax.el.ExpressionFactory'	I try to write very simple application with hibernate validator: my steps: add following dependency in pom.xml: -CODE- . write code: -CODE- . And I gets following stacktrace: -CODE- . What do I wrong?	no
613	https://stackoverflow.com/questions/9854166	: What is the Java equivalent of unsigned?	Declaring an unsigned int in Java	Is there a way to declare an unsigned int in Java? Or the question may be framed as this as well: What is the Java equivalent of unsigned? Just to tell you the context I was looking at Java's implementation of String.hashcode(). I wanted to test the possibility of collision if the integer were 32 unsigned int.	no
614	https://stackoverflow.com/questions/20405474	Add context path to Spring Boot application	Add context path to Spring Boot application	"I am trying to set a Spring Boot applications context root programmatically. The reason for the context root is we want the app to be accessed from localhost:port/{app_name} and have all the controller paths append to it. Here is the application configuration file for the web-app. -CODE- . Here is the index controller for the main page. -CODE- . The new root of the application should be at localhost:12378/mainstay, but it is still located at localhost:12378. What am I missing that is causing Spring Boot to not append the context root before the request mapping?"	no
615	https://stackoverflow.com/questions/20405474	I am trying to set a Spring Boot applications context root programmatically.	Add context path to Spring Boot application	"I am trying to set a Spring Boot applications context root programmatically. The reason for the context root is we want the app to be accessed from localhost:port/{app_name} and have all the controller paths append to it. Here is the application configuration file for the web-app. -CODE- . Here is the index controller for the main page. -CODE- . The new root of the application should be at localhost:12378/mainstay, but it is still located at localhost:12378. What am I missing that is causing Spring Boot to not append the context root before the request mapping?"	no
616	https://stackoverflow.com/questions/27598078	The float data type is a single-precision 32-bit IEEE 754 floating point and the double data type is a double-precision 64-bit IEEE 754 floating point.	Float and double datatype in Java	The float data type is a single-precision 32-bit IEEE 754 floating point and the double data type is a double-precision 64-bit IEEE 754 floating point. What does it mean? And when should I use float instead of double or vice-versa?	no
