,url,sentence,title,body,arbitration
0,https://stackoverflow.com/questions/1018750,How to convert object array to string array in Java,How to convert object array to string array in Java,"I use the following code to convert an Object array to a String array : -CODE- . But I wonder if there is another way to do this, something like : -CODE- . But this would cause a runtime error: Exception in thread ""AWT-EventQueue-0"" java.lang.ClassCastException: [Ljava.lang.Object; cannot be cast to [Ljava.lang.String; What's the correct way to do it ?",yes
1,https://stackoverflow.com/questions/1018750,": Exception in thread ""AWT-EventQueue-0"" java.lang.ClassCastException: [Ljava.lang.Object; cannot be cast to [Ljava.lang.String;",How to convert object array to string array in Java,"I use the following code to convert an Object array to a String array : -CODE- . But I wonder if there is another way to do this, something like : -CODE- . But this would cause a runtime error: Exception in thread ""AWT-EventQueue-0"" java.lang.ClassCastException: [Ljava.lang.Object; cannot be cast to [Ljava.lang.String; What's the correct way to do it ?",no
2,https://stackoverflow.com/questions/1018750,I use the following code to convert an Object array to a String array : -CODE- .,How to convert object array to string array in Java,"I use the following code to convert an Object array to a String array : -CODE- . But I wonder if there is another way to do this, something like : -CODE- . But this would cause a runtime error: Exception in thread ""AWT-EventQueue-0"" java.lang.ClassCastException: [Ljava.lang.Object; cannot be cast to [Ljava.lang.String; What's the correct way to do it ?",yes
3,https://stackoverflow.com/questions/12575990,Calendar date to yyyy-MM-dd format in java,Calendar date to yyyy-MM-dd format in java,How to convert calendar date to yyyy-MM-dd format. -CODE- . This will produce inActiveDate = Wed Sep 26 00:00:00 IST 2012. But what I need is 2012-09-26. My purpose is to compare this date with another date in my database using Hibernate criteria. So I need the date object in yyyy-MM-dd format.,yes
4,https://stackoverflow.com/questions/12575990,How to convert calendar date to yyyy-MM-dd format.,Calendar date to yyyy-MM-dd format in java,How to convert calendar date to yyyy-MM-dd format. -CODE- . This will produce inActiveDate = Wed Sep 26 00:00:00 IST 2012. But what I need is 2012-09-26. My purpose is to compare this date with another date in my database using Hibernate criteria. So I need the date object in yyyy-MM-dd format.,yes
5,https://stackoverflow.com/questions/12575990,=,Calendar date to yyyy-MM-dd format in java,How to convert calendar date to yyyy-MM-dd format. -CODE- . This will produce inActiveDate = Wed Sep 26 00:00:00 IST 2012. But what I need is 2012-09-26. My purpose is to compare this date with another date in my database using Hibernate criteria. So I need the date object in yyyy-MM-dd format.,no
6,https://stackoverflow.com/questions/12575990,My purpose is to compare this date with another date in my database using Hibernate criteria.,Calendar date to yyyy-MM-dd format in java,How to convert calendar date to yyyy-MM-dd format. -CODE- . This will produce inActiveDate = Wed Sep 26 00:00:00 IST 2012. But what I need is 2012-09-26. My purpose is to compare this date with another date in my database using Hibernate criteria. So I need the date object in yyyy-MM-dd format.,yes
7,https://stackoverflow.com/questions/12575990,So I need the date object in yyyy-MM-dd format.,Calendar date to yyyy-MM-dd format in java,How to convert calendar date to yyyy-MM-dd format. -CODE- . This will produce inActiveDate = Wed Sep 26 00:00:00 IST 2012. But what I need is 2012-09-26. My purpose is to compare this date with another date in my database using Hibernate criteria. So I need the date object in yyyy-MM-dd format.,yes
8,https://stackoverflow.com/questions/1536054,How to convert byte array to string and vice versa?,How to convert byte array to string and vice versa?,"I have to convert a byte array to string in Android, but my byte array contains negative values. If I convert that string again to byte array, values I am getting are different from original byte array values. What can I do to get proper conversion? Code I am using to do the conversion is as follows: -CODE- . I am stuck in this problem.",yes
9,https://stackoverflow.com/questions/1536054,I am stuck in this problem.,How to convert byte array to string and vice versa?,"I have to convert a byte array to string in Android, but my byte array contains negative values. If I convert that string again to byte array, values I am getting are different from original byte array values. What can I do to get proper conversion? Code I am using to do the conversion is as follows: -CODE- . I am stuck in this problem.",no
10,https://stackoverflow.com/questions/1536054,What can I do to get proper conversion?,How to convert byte array to string and vice versa?,"I have to convert a byte array to string in Android, but my byte array contains negative values. If I convert that string again to byte array, values I am getting are different from original byte array values. What can I do to get proper conversion? Code I am using to do the conversion is as follows: -CODE- . I am stuck in this problem.",no
11,https://stackoverflow.com/questions/1536054,"I have to convert a byte array to string in Android, but my byte array contains negative values.",How to convert byte array to string and vice versa?,"I have to convert a byte array to string in Android, but my byte array contains negative values. If I convert that string again to byte array, values I am getting are different from original byte array values. What can I do to get proper conversion? Code I am using to do the conversion is as follows: -CODE- . I am stuck in this problem.",yes
12,https://stackoverflow.com/questions/21488056,How to negate a method reference predicate,How to negate a method reference predicate,"In Java 8, you can use a method reference to filter a stream, for example: -CODE- . Is there a way to create a method reference that is the negation of an existing one, i.e. something like: -CODE- . I could create the not method like below but I was wondering if the JDK offered something similar. -CODE- .",yes
13,https://stackoverflow.com/questions/5778658,How to convert OutputStream to InputStream?,How to convert OutputStream to InputStream?,"I am on the stage of development, where I have two modules and from one I got output as a OutputStream and second one, which accepts only InputStream. Do you know how to convert OutputStream to InputStream (not vice versa, I mean really this way) that I will be able to connect these two parts? Thanks.",yes
14,https://stackoverflow.com/questions/9863742,How to pass an ArrayList to a varargs method parameter?,How to pass an ArrayList to a varargs method parameter?,"Basically I have an ArrayList of locations: -CODE- . below this I call the following method: -CODE- . the parameters in the getMap() method are: -CODE- . The problem I'm having is I'm not sure how to pass in the WHOLE list of locations into that method. I've tried: -CODE- . but getMap doesn't accept that because it doesn't accept Objects[]. Now if I use: -CODE- . it will work perfectly... but I need to somehow pass in ALL of the locations... I could of course make keep adding locations.get(1), locations.get(2) etc. but the size of the array varies. I'm just not use to the whole concept of an ArrayList. What would be the easiest way to go about this? I feel like I'm just not thinking straight right now.",yes
15,https://stackoverflow.com/questions/9863742,Now if I use: -CODE- .,How to pass an ArrayList to a varargs method parameter?,"Basically I have an ArrayList of locations: -CODE- . below this I call the following method: -CODE- . the parameters in the getMap() method are: -CODE- . The problem I'm having is I'm not sure how to pass in the WHOLE list of locations into that method. I've tried: -CODE- . but getMap doesn't accept that because it doesn't accept Objects[]. Now if I use: -CODE- . it will work perfectly... but I need to somehow pass in ALL of the locations... I could of course make keep adding locations.get(1), locations.get(2) etc. but the size of the array varies. I'm just not use to the whole concept of an ArrayList. What would be the easiest way to go about this? I feel like I'm just not thinking straight right now.",no
16,https://stackoverflow.com/questions/9863742,below this I call the following method: -CODE- .,How to pass an ArrayList to a varargs method parameter?,"Basically I have an ArrayList of locations: -CODE- . below this I call the following method: -CODE- . the parameters in the getMap() method are: -CODE- . The problem I'm having is I'm not sure how to pass in the WHOLE list of locations into that method. I've tried: -CODE- . but getMap doesn't accept that because it doesn't accept Objects[]. Now if I use: -CODE- . it will work perfectly... but I need to somehow pass in ALL of the locations... I could of course make keep adding locations.get(1), locations.get(2) etc. but the size of the array varies. I'm just not use to the whole concept of an ArrayList. What would be the easiest way to go about this? I feel like I'm just not thinking straight right now.",no
17,https://stackoverflow.com/questions/34957430,How to convert a kotlin source file to a java source file,How to convert a kotlin source file to a java source file,"I have a Kotlin source file, but I want to translate it to Java. How can I convert Kotlin to Java source?",yes
18,https://stackoverflow.com/questions/34957430,How can I convert Kotlin to Java source?,How to convert a kotlin source file to a java source file,"I have a Kotlin source file, but I want to translate it to Java. How can I convert Kotlin to Java source?",yes
19,https://stackoverflow.com/questions/5804043,Convert Long into Integer,Convert Long into Integer,How to convert a Long value into an Integer value in Java?,yes
20,https://stackoverflow.com/questions/5804043,How to convert a Long value into an Integer value in Java?,Convert Long into Integer,How to convert a Long value into an Integer value in Java?,yes
21,https://stackoverflow.com/questions/7899525,How to split a String by space,How to split a String by space,I need to split my String by spaces. For this I tried: -CODE- . But it doesn't seem to work.,yes
22,https://stackoverflow.com/questions/7899525,I need to split my String by spaces.,How to split a String by space,I need to split my String by spaces. For this I tried: -CODE- . But it doesn't seem to work.,yes
23,https://stackoverflow.com/questions/18441846,How to sort an ArrayList in Java,How to sort an ArrayList in Java,I have a class named Fruit. I am creating a list of this class and adding each fruit in the list. I want to sort this list based on the order of fruit name. -CODE- . and I am creating its list using for loop: -CODE- . and I need to sort this arrayList using the fruit name of each object in the list. how??,yes
24,https://stackoverflow.com/questions/18441846,and I need to sort this arrayList using the fruit name of each object in the list.,How to sort an ArrayList in Java,I have a class named Fruit. I am creating a list of this class and adding each fruit in the list. I want to sort this list based on the order of fruit name. -CODE- . and I am creating its list using for loop: -CODE- . and I need to sort this arrayList using the fruit name of each object in the list. how??,yes
25,https://stackoverflow.com/questions/4812570,How to store printStackTrace into a string,How to store printStackTrace into a string,How can I get the e.printStackTrace() and store it into a String variable? I want to use the string generated by e.printStackTrace() later in my program. I'm still new to Java so I'm not too familiar with StringWriter that I think will be the solution. Or if you have any other ideas please let me know. Thanks.,yes
26,https://stackoverflow.com/questions/4812570,How can I get the e.printStackTrace() and store it into a String variable?,How to store printStackTrace into a string,How can I get the e.printStackTrace() and store it into a String variable? I want to use the string generated by e.printStackTrace() later in my program. I'm still new to Java so I'm not too familiar with StringWriter that I think will be the solution. Or if you have any other ideas please let me know. Thanks.,yes
27,https://stackoverflow.com/questions/4138364,Java: How to convert List to Map,Java: How to convert List to Map,Recently I have conversation with a colleague about what would be the optimal way to convert List to Map in Java and if there any specific benefits of doing so. I want to know optimal conversion approach and would really appreciate if any one can guide me. Is this good approach: -CODE- .,yes
28,https://stackoverflow.com/questions/470690,"How to automatically generate N ""distinct"" colors?","How to automatically generate N ""distinct"" colors?","I wrote the two methods below to automatically select N distinct colors. It works by defining a piecewise linear function on the RGB cube. The benefit of this is you can also get a progressive scale if that's what you want, but when N gets large the colors can start to look similar. I can also imagine evenly subdividing the RGB cube into a lattice and then drawing points. Does anyone know any other methods? I'm ruling out defining a list and then just cycling through it. I should also say I don't generally care if they clash or don't look nice, they just have to be visually distinct. -CODE- .",yes
29,https://stackoverflow.com/questions/470690,I wrote the two methods below to automatically select N distinct colors.,"How to automatically generate N ""distinct"" colors?","I wrote the two methods below to automatically select N distinct colors. It works by defining a piecewise linear function on the RGB cube. The benefit of this is you can also get a progressive scale if that's what you want, but when N gets large the colors can start to look similar. I can also imagine evenly subdividing the RGB cube into a lattice and then drawing points. Does anyone know any other methods? I'm ruling out defining a list and then just cycling through it. I should also say I don't generally care if they clash or don't look nice, they just have to be visually distinct. -CODE- .",yes
30,https://stackoverflow.com/questions/470690,I should also say I don't generally care,"How to automatically generate N ""distinct"" colors?","I wrote the two methods below to automatically select N distinct colors. It works by defining a piecewise linear function on the RGB cube. The benefit of this is you can also get a progressive scale if that's what you want, but when N gets large the colors can start to look similar. I can also imagine evenly subdividing the RGB cube into a lattice and then drawing points. Does anyone know any other methods? I'm ruling out defining a list and then just cycling through it. I should also say I don't generally care if they clash or don't look nice, they just have to be visually distinct. -CODE- .",no
31,https://stackoverflow.com/questions/470690,I'm ruling out defining a list and then just cycling through it.,"How to automatically generate N ""distinct"" colors?","I wrote the two methods below to automatically select N distinct colors. It works by defining a piecewise linear function on the RGB cube. The benefit of this is you can also get a progressive scale if that's what you want, but when N gets large the colors can start to look similar. I can also imagine evenly subdividing the RGB cube into a lattice and then drawing points. Does anyone know any other methods? I'm ruling out defining a list and then just cycling through it. I should also say I don't generally care if they clash or don't look nice, they just have to be visually distinct. -CODE- .",no
32,https://stackoverflow.com/questions/6539879,How to convert a color integer to a hex String in Android?,How to convert a color integer to a hex String in Android?,I have an integer that was generated from an android.graphics.Color. The Integer has a value of -16776961. How do I convert this value into a hex string with the format #RRGGBB. Simply put: I would like to output #0000FF from -16776961. Note: I do not want the output to contain an alpha and i have also tried this example without any success.,yes
33,https://stackoverflow.com/questions/6539879,How do I convert this value into a hex string with the format #RRGGBB.,How to convert a color integer to a hex String in Android?,I have an integer that was generated from an android.graphics.Color. The Integer has a value of -16776961. How do I convert this value into a hex string with the format #RRGGBB. Simply put: I would like to output #0000FF from -16776961. Note: I do not want the output to contain an alpha and i have also tried this example without any success.,yes
34,https://stackoverflow.com/questions/2525042,"How to convert a JSON string to a Map<String, String> with Jackson JSON","How to convert a JSON string to a Map<String, String> with Jackson JSON","I'm trying to do something like this but it doesn't work: -CODE- . But the IDE says: -CODE- . What's the right way to do this? I'm only using Jackson because that's what is already available in the project, is there a native Java way of converting to/from JSON? In PHP I would simply json_decode($str) and I'd get back an array. I need basically the same thing here.",yes
35,https://stackoverflow.com/questions/7071281,How to get Android device name?,Get Android Device Name,How to get Android device name? I am using HTC desire. When I connected it via HTC Sync the software is displaying the Name 'HTC Smith' . I would like to fetch this name via code. How is this possible in Android?,yes
36,https://stackoverflow.com/questions/2442599,"How to set JFrame to appear centered, regardless of monitor resolution?","How to set JFrame to appear centered, regardless of monitor resolution?","While working with Java, I find it hard to position my main window in the center of the screen when I start the application. Is there any way I can do that? It doesn't have to be vertically centered, horizontal alignment is the more important goal for me. But vertical alignment is also welcome.",yes
37,https://stackoverflow.com/questions/2319538,Most concise way to convert a Set<String> to a List<String>,Most concise way to convert a Set<String> to a List<String>,I am currently doing this: -CODE- . Can you beat this ?,yes
38,https://stackoverflow.com/questions/1302605,How do I convert from int to Long in Java?,How do I convert from int to Long in Java?,"I keep finding both on here and Google people having troubles going from long to int and not the other way around. Yet I'm sure I'm not the only one that has run into this scenario before going from int to Long. The only other answers I've found were ""Just set it as Long in the first place"" which really doesn't address the question. Can someone help me out here? I initially tried casting but I get a ""Cannot cast from int to Long"" -CODE- . As you can imagine I'm a little perplexed, I'm stuck using int since some content is coming in as an ArrayList and the entity for which I'm storing this info requires the sequence number as a Long. Thanks!",yes
39,https://stackoverflow.com/questions/1667212,How to add reference to a method parameter in javadoc?,How to add reference to a method parameter in javadoc?,Is there a way to add references to one or more of a method's parameters from the method documentation body? Something like: -CODE- .,yes
40,https://stackoverflow.com/questions/1667212,Is there a way to add references to one or more of a method's parameters from the method documentation body?,How to add reference to a method parameter in javadoc?,Is there a way to add references to one or more of a method's parameters from the method documentation body? Something like: -CODE- .,yes
41,https://stackoverflow.com/questions/3322152,Is there a way to get rid of accents and convert a whole string to regular letters?,Is there a way to get rid of accents and convert a whole string to regular letters?,Is there a better way for getting rid of accents and making those letters regular apart from using String.replaceAll() method and replacing letters one by one? Example: Input: orčpžsíáýd. Output: orcpzsiayd. It doesn't need to include all letters with accents like the Russian alphabet or the Chinese one.,yes
42,https://stackoverflow.com/questions/3322152,Output: orcpzsiayd.,Is there a way to get rid of accents and convert a whole string to regular letters?,Is there a better way for getting rid of accents and making those letters regular apart from using String.replaceAll() method and replacing letters one by one? Example: Input: orčpžsíáýd. Output: orcpzsiayd. It doesn't need to include all letters with accents like the Russian alphabet or the Chinese one.,no
43,https://stackoverflow.com/questions/2163045,How to remove line breaks from a file in Java?,How to remove line breaks from a file in Java?,How can I replace all line breaks from a string in Java in such a way that will work on Windows and Linux (ie no OS specific problems of carriage return/line feed/new line etc.)? I've tried (note readFileAsString is a function that reads a text file into a String): -CODE- . but this doesn't seem to work. How can this be done?,yes
44,https://stackoverflow.com/questions/2163045,How can I replace all line breaks from a string in Java in such a way that will work on Windows and Linux (ie no OS specific problems of carriage return/line feed/new line etc.)?,How to remove line breaks from a file in Java?,How can I replace all line breaks from a string in Java in such a way that will work on Windows and Linux (ie no OS specific problems of carriage return/line feed/new line etc.)? I've tried (note readFileAsString is a function that reads a text file into a String): -CODE- . but this doesn't seem to work. How can this be done?,yes
45,https://stackoverflow.com/questions/3653996,How to parse a JSON string into JsonNode in Jackson?,How to parse a JSON string into JsonNode in Jackson?,"It should be so simple, but I just cannot find it after being trying for an hour #embarrasing. I need to get a JSON string, for example, {""k1"":v1,""k2"":v2}, parsed as a JsonNode. -CODE- . gives : -CODE- .",yes
46,https://stackoverflow.com/questions/3653996,"I need to get a JSON string, for example, {""k1"":v1,""k2"":v2}, parsed as a JsonNode.",How to parse a JSON string into JsonNode in Jackson?,"It should be so simple, but I just cannot find it after being trying for an hour #embarrasing. I need to get a JSON string, for example, {""k1"":v1,""k2"":v2}, parsed as a JsonNode. -CODE- . gives : -CODE- .",yes
47,https://stackoverflow.com/questions/5883635,How to remove all callbacks from a Handler?,How to remove all callbacks from a Handler?,"I have a Handler from my sub-Activity that was called by the main Activity. This Handler is used by sub-classes to postDelay some Runnables, and I can't manage them. Now, in the onStop event, I need to remove them before finishing the Activity (somehow I called finish(), but it still call again and again). Is there anyway to remove all callbacks from a Handler?",yes
48,https://stackoverflow.com/questions/5883635,Is there anyway to remove all callbacks from a Handler?,How to remove all callbacks from a Handler?,"I have a Handler from my sub-Activity that was called by the main Activity. This Handler is used by sub-classes to postDelay some Runnables, and I can't manage them. Now, in the onStop event, I need to remove them before finishing the Activity (somehow I called finish(), but it still call again and again). Is there anyway to remove all callbacks from a Handler?",yes
49,https://stackoverflow.com/questions/3891375,How to read a text-file resource into Java unit test?,How to read a text-file resource into Java unit test?,I have a unit test that needs to work with XML file located in src/test/resources/abc.xml. What is the easiest way just to get the content of the file into String?,yes
50,https://stackoverflow.com/questions/5958169,How to merge two sorted arrays into a sorted array?,How to merge two sorted arrays into a sorted array?,This was asked of me in an interview and this is the solution I provided: -CODE- . Is there a more efficient way to do this? Edit: Corrected length methods.,yes
51,https://stackoverflow.com/questions/5958169,and this is the solution I provided: -CODE- .,How to merge two sorted arrays into a sorted array?,This was asked of me in an interview and this is the solution I provided: -CODE- . Is there a more efficient way to do this? Edit: Corrected length methods.,no
52,https://stackoverflow.com/questions/5958169,Is there a more efficient way to do this?,How to merge two sorted arrays into a sorted array?,This was asked of me in an interview and this is the solution I provided: -CODE- . Is there a more efficient way to do this? Edit: Corrected length methods.,no
53,https://stackoverflow.com/questions/9292954,How to make a copy of a file in android?,How to make a copy of a file in android?,In my app I want to save a copy of a certain file with a different name (which I get from user) Do I really need to open the contents of the file and write it to another file? What is the best way to do so?,yes
54,https://stackoverflow.com/questions/14534767,How to append a newline to StringBuilder,How to append a newline to StringBuilder,"I have a StringBuilder object, -CODE- . Now I want to append a newline character to the StringBuilder. How can I do it? -CODE- . Does not work. So, I was thinking about writing a newline using Unicode. Will this help? If so, how can I add one?",yes
